[
    {
        "Experience":"5 to 15 Years",
        "Qualifications":"M.Tech",
        "Salary Range":"$59K-$99K",
        "Job Title":"Digital Marketing Specialist",
        "Role":"Social Media Manager",
        "Job Description":"Social Media Managers oversee an organizations social media presence. They create and schedule content, engage with followers, and analyze social media metrics to drive brand awareness and engagement.",
        "skills":"Social media platforms (e.g., Facebook, Twitter, Instagram) Content creation and scheduling Social media analytics and insights Community engagement Paid social advertising",
        "Responsibilities":"Manage and grow social media accounts, create engaging content, and interact with the online community. Develop social media content calendars and strategies. Monitor social media trends and engagement metrics.",
        "Summary":"\n  Job Tile: Digital Marketing Specialist\n  Job Description: Social Media Managers oversee an organizations social media presence. They create and schedule content, engage with followers, and analyze social media metrics to drive brand awareness and engagement.\n  Qualification: M.Tech\n  Experience: 5 to 15 Years\n  Skills: Social media platforms (e.g., Facebook, Twitter, Instagram) Content creation and scheduling Social media analytics and insights Community engagement Paid social advertising\n  Responsibilities: Manage and grow social media accounts, create engaging content, and interact with the online community. Develop social media content calendars and strategies. Monitor social media trends and engagement metrics.\n  "
    },
    {
        "Experience":"2 to 12 Years",
        "Qualifications":"BCA",
        "Salary Range":"$56K-$116K",
        "Job Title":"Web Developer",
        "Role":"Frontend Web Developer",
        "Job Description":"Frontend Web Developers design and implement user interfaces for websites, ensuring they are visually appealing and user-friendly. They collaborate with designers and backend developers to create seamless web experiences for users.",
        "skills":"HTML, CSS, JavaScript Frontend frameworks (e.g., React, Angular) User experience (UX)",
        "Responsibilities":"Design and code user interfaces for websites, ensuring a seamless and visually appealing user experience. Collaborate with UX designers to optimize user journeys. Ensure cross-browser compatibility and responsive design.",
        "Summary":"\n  Job Tile: Web Developer\n  Job Description: Frontend Web Developers design and implement user interfaces for websites, ensuring they are visually appealing and user-friendly. They collaborate with designers and backend developers to create seamless web experiences for users.\n  Qualification: BCA\n  Experience: 2 to 12 Years\n  Skills: HTML, CSS, JavaScript Frontend frameworks (e.g., React, Angular) User experience (UX)\n  Responsibilities: Design and code user interfaces for websites, ensuring a seamless and visually appealing user experience. Collaborate with UX designers to optimize user journeys. Ensure cross-browser compatibility and responsive design.\n  "
    },
    {
        "Experience":"0 to 12 Years",
        "Qualifications":"PhD",
        "Salary Range":"$61K-$104K",
        "Job Title":"Operations Manager",
        "Role":"Quality Control Manager",
        "Job Description":"Quality Control Managers establish and enforce quality standards within an organization. They develop quality control processes, perform inspections, and implement corrective actions to maintain product or service quality.",
        "skills":"Quality control processes and methodologies Statistical process control (SPC) Root cause analysis and corrective action Quality management systems (e.g., ISO 9001) Compliance and regulatory knowledge",
        "Responsibilities":"Establish and enforce quality control standards and procedures. Conduct quality audits and inspections. Collaborate with production teams to address quality issues and implement improvements.",
        "Summary":"\n  Job Tile: Operations Manager\n  Job Description: Quality Control Managers establish and enforce quality standards within an organization. They develop quality control processes, perform inspections, and implement corrective actions to maintain product or service quality.\n  Qualification: PhD\n  Experience: 0 to 12 Years\n  Skills: Quality control processes and methodologies Statistical process control (SPC) Root cause analysis and corrective action Quality management systems (e.g., ISO 9001) Compliance and regulatory knowledge\n  Responsibilities: Establish and enforce quality control standards and procedures. Conduct quality audits and inspections. Collaborate with production teams to address quality issues and implement improvements.\n  "
    },
    {
        "Experience":"4 to 11 Years",
        "Qualifications":"PhD",
        "Salary Range":"$65K-$91K",
        "Job Title":"Network Engineer",
        "Role":"Wireless Network Engineer",
        "Job Description":"Wireless Network Engineers design, implement, and maintain wireless network solutions. They optimize wireless connectivity, troubleshoot issues, and ensure reliable and secure wireless communications.",
        "skills":"Wireless network design and architecture Wi-Fi standards and protocols RF (Radio Frequency) planning and optimization Wireless security protocols Troubleshooting wireless network issues",
        "Responsibilities":"Design, configure, and optimize wireless networks, ensuring reliable and secure wireless connectivity. Troubleshoot wireless network issues. Plan and implement wireless network upgrades.",
        "Summary":"\n  Job Tile: Network Engineer\n  Job Description: Wireless Network Engineers design, implement, and maintain wireless network solutions. They optimize wireless connectivity, troubleshoot issues, and ensure reliable and secure wireless communications.\n  Qualification: PhD\n  Experience: 4 to 11 Years\n  Skills: Wireless network design and architecture Wi-Fi standards and protocols RF (Radio Frequency) planning and optimization Wireless security protocols Troubleshooting wireless network issues\n  Responsibilities: Design, configure, and optimize wireless networks, ensuring reliable and secure wireless connectivity. Troubleshoot wireless network issues. Plan and implement wireless network upgrades.\n  "
    },
    {
        "Experience":"1 to 12 Years",
        "Qualifications":"MBA",
        "Salary Range":"$64K-$87K",
        "Job Title":"Event Manager",
        "Role":"Conference Manager",
        "Job Description":"A Conference Manager coordinates and manages conferences, meetings, and events. They plan logistics, handle budgeting, liaise with vendors, and ensure the smooth execution of events, catering to the needs and expectations of attendees.",
        "skills":"Event planning Conference logistics Budget management Vendor coordination Marketing and promotion Client relations",
        "Responsibilities":"Specialize in conference and convention planning. Coordinate speaker sessions, exhibitors, and attendee experiences. Oversee event registration and marketing.",
        "Summary":"\n  Job Tile: Event Manager\n  Job Description: A Conference Manager coordinates and manages conferences, meetings, and events. They plan logistics, handle budgeting, liaise with vendors, and ensure the smooth execution of events, catering to the needs and expectations of attendees.\n  Qualification: MBA\n  Experience: 1 to 12 Years\n  Skills: Event planning Conference logistics Budget management Vendor coordination Marketing and promotion Client relations\n  Responsibilities: Specialize in conference and convention planning. Coordinate speaker sessions, exhibitors, and attendee experiences. Oversee event registration and marketing.\n  "
    },
    {
        "Experience":"4 to 12 Years",
        "Qualifications":"MCA",
        "Salary Range":"$59K-$93K",
        "Job Title":"Software Tester",
        "Role":"Quality Assurance Analyst",
        "Job Description":"A Quality Assurance Analyst tests software and products to ensure they meet quality standards. They identify defects, report issues, and work with development teams to resolve problems.",
        "skills":"Quality assurance processes Testing methodologies (e.g., manual, automated) Bug tracking and reporting Test case development Regression testing",
        "Responsibilities":"Test software applications and systems to identify defects and ensure quality. Create test plans, test cases, and test scripts. Collaborate with development teams to resolve issues.",
        "Summary":"\n  Job Tile: Software Tester\n  Job Description: A Quality Assurance Analyst tests software and products to ensure they meet quality standards. They identify defects, report issues, and work with development teams to resolve problems.\n  Qualification: MCA\n  Experience: 4 to 12 Years\n  Skills: Quality assurance processes Testing methodologies (e.g., manual, automated) Bug tracking and reporting Test case development Regression testing\n  Responsibilities: Test software applications and systems to identify defects and ensure quality. Create test plans, test cases, and test scripts. Collaborate with development teams to resolve issues.\n  "
    },
    {
        "Experience":"3 to 15 Years",
        "Qualifications":"PhD",
        "Salary Range":"$63K-$103K",
        "Job Title":"Teacher",
        "Role":"Classroom Teacher",
        "Job Description":"A Classroom Teacher educates students in a specific subject or grade level. They create lesson plans, deliver instruction, assess student progress, and foster a positive learning environment.",
        "skills":"Teaching pedagogy Classroom management Curriculum development Student assessment Differentiated instruction",
        "Responsibilities":"Plan and deliver engaging lessons, adapting teaching methods to student needs. Assess student progress and provide feedback. Create a positive and inclusive classroom environment.",
        "Summary":"\n  Job Tile: Teacher\n  Job Description: A Classroom Teacher educates students in a specific subject or grade level. They create lesson plans, deliver instruction, assess student progress, and foster a positive learning environment.\n  Qualification: PhD\n  Experience: 3 to 15 Years\n  Skills: Teaching pedagogy Classroom management Curriculum development Student assessment Differentiated instruction\n  Responsibilities: Plan and deliver engaging lessons, adapting teaching methods to student needs. Assess student progress and provide feedback. Create a positive and inclusive classroom environment.\n  "
    },
    {
        "Experience":"2 to 8 Years",
        "Qualifications":"M.Com",
        "Salary Range":"$65K-$102K",
        "Job Title":"UX\/UI Designer",
        "Role":"User Interface Designer",
        "Job Description":"User Interface Designers focus on the visual and interactive aspects of digital interfaces. They design layouts, buttons, and other elements to ensure a cohesive and visually appealing user interface.",
        "skills":"UI design principles and best practices Graphic design tools (e.g., Adobe Photoshop, Illustrator) Typography and color theory Visual design and layout Responsive design",
        "Responsibilities":"Create visually appealing user interfaces (UI) that align with brand aesthetics and enhance user engagement. Design interface elements and interactive components. Ensure UI consistency across digital platforms.",
        "Summary":"\n  Job Tile: UX\/UI Designer\n  Job Description: User Interface Designers focus on the visual and interactive aspects of digital interfaces. They design layouts, buttons, and other elements to ensure a cohesive and visually appealing user interface.\n  Qualification: M.Com\n  Experience: 2 to 8 Years\n  Skills: UI design principles and best practices Graphic design tools (e.g., Adobe Photoshop, Illustrator) Typography and color theory Visual design and layout Responsive design\n  Responsibilities: Create visually appealing user interfaces (UI) that align with brand aesthetics and enhance user engagement. Design interface elements and interactive components. Ensure UI consistency across digital platforms.\n  "
    },
    {
        "Experience":"1 to 10 Years",
        "Qualifications":"BBA",
        "Salary Range":"$60K-$80K",
        "Job Title":"Wedding Planner",
        "Role":"Wedding Consultant",
        "Job Description":"A Wedding Consultant assists couples in planning and coordinating their weddings, helping them with vendor selection, budget management, and ensuring a seamless wedding day experience.",
        "skills":"Wedding planning Vendor coordination Event management",
        "Responsibilities":"Offer expert advice and guidance to couples planning their weddings. Assist with wedding theme and design selection. Coordinate and negotiate with vendors.",
        "Summary":"\n  Job Tile: Wedding Planner\n  Job Description: A Wedding Consultant assists couples in planning and coordinating their weddings, helping them with vendor selection, budget management, and ensuring a seamless wedding day experience.\n  Qualification: BBA\n  Experience: 1 to 10 Years\n  Skills: Wedding planning Vendor coordination Event management\n  Responsibilities: Offer expert advice and guidance to couples planning their weddings. Assist with wedding theme and design selection. Coordinate and negotiate with vendors.\n  "
    },
    {
        "Experience":"3 to 10 Years",
        "Qualifications":"BCA",
        "Salary Range":"$57K-$104K",
        "Job Title":"QA Analyst",
        "Role":"Performance Testing Specialist",
        "Job Description":"Performance Testing Specialists assess the performance of software applications by conducting load, stress, and scalability tests. They identify bottlenecks, optimize performance, and ensure software can handle user demands effectively.",
        "skills":"Performance testing Load testing Stress testing Test scenarios Performance monitoring Benchmarking Performance analysis",
        "Responsibilities":"Focus on performance and load testing to assess the scalability and responsiveness of software applications. Identify bottlenecks and optimize application performance. Generate performance test reports and recommendations.",
        "Summary":"\n  Job Tile: QA Analyst\n  Job Description: Performance Testing Specialists assess the performance of software applications by conducting load, stress, and scalability tests. They identify bottlenecks, optimize performance, and ensure software can handle user demands effectively.\n  Qualification: BCA\n  Experience: 3 to 10 Years\n  Skills: Performance testing Load testing Stress testing Test scenarios Performance monitoring Benchmarking Performance analysis\n  Responsibilities: Focus on performance and load testing to assess the scalability and responsiveness of software applications. Identify bottlenecks and optimize application performance. Generate performance test reports and recommendations.\n  "
    },
    {
        "Experience":"4 to 12 Years",
        "Qualifications":"B.Tech",
        "Salary Range":"$64K-$98K",
        "Job Title":"Litigation Attorney",
        "Role":"Family Law Attorney",
        "Job Description":"Family Law Attorneys deal with legal matters related to family relationships. They handle cases like divorce, child custody, adoption, and domestic disputes to provide legal guidance.",
        "skills":"Family law Divorce proceedings Child custody Mediation Legal counseling Court representation",
        "Responsibilities":"Specialize in family law matters, such as divorce, child custody, and adoption. Advocate for clients in family court proceedings. Offer legal advice and mediation services.",
        "Summary":"\n  Job Tile: Litigation Attorney\n  Job Description: Family Law Attorneys deal with legal matters related to family relationships. They handle cases like divorce, child custody, adoption, and domestic disputes to provide legal guidance.\n  Qualification: B.Tech\n  Experience: 4 to 12 Years\n  Skills: Family law Divorce proceedings Child custody Mediation Legal counseling Court representation\n  Responsibilities: Specialize in family law matters, such as divorce, child custody, and adoption. Advocate for clients in family court proceedings. Offer legal advice and mediation services.\n  "
    },
    {
        "Experience":"3 to 15 Years",
        "Qualifications":"MCA",
        "Salary Range":"$65K-$122K",
        "Job Title":"Mechanical Engineer",
        "Role":"Mechanical Design Engineer",
        "Job Description":"Mechanical Design Engineers create and develop mechanical systems and components, from concept to manufacturing, ensuring functionality and safety.",
        "skills":"Mechanical engineering CAD software (e.g., SolidWorks, AutoCAD) Finite element analysis Product development Prototyping",
        "Responsibilities":"Design mechanical systems, components, and products. Create 3D models and detailed engineering drawings. Perform structural and thermal analyses.",
        "Summary":"\n  Job Tile: Mechanical Engineer\n  Job Description: Mechanical Design Engineers create and develop mechanical systems and components, from concept to manufacturing, ensuring functionality and safety.\n  Qualification: MCA\n  Experience: 3 to 15 Years\n  Skills: Mechanical engineering CAD software (e.g., SolidWorks, AutoCAD) Finite element analysis Product development Prototyping\n  Responsibilities: Design mechanical systems, components, and products. Create 3D models and detailed engineering drawings. Perform structural and thermal analyses.\n  "
    },
    {
        "Experience":"1 to 8 Years",
        "Qualifications":"B.Com",
        "Salary Range":"$56K-$86K",
        "Job Title":"Network Administrator",
        "Role":"Network Security Analyst",
        "Job Description":"Protect an organizations computer networks and systems from security threats, monitor network traffic, and respond to incidents.",
        "skills":"Network security protocols Intrusion detection and prevention Security incident response Firewall administration Vulnerability assessment Security policies and procedures Log analysis Ethical hacking Problem-solving Communication skills Attention to detail",
        "Responsibilities":"Manage and secure computer networks, including firewalls and intrusion detection systems. Monitor network traffic for security threats. Implement security policies and procedures.",
        "Summary":"\n  Job Tile: Network Administrator\n  Job Description: Protect an organizations computer networks and systems from security threats, monitor network traffic, and respond to incidents.\n  Qualification: B.Com\n  Experience: 1 to 8 Years\n  Skills: Network security protocols Intrusion detection and prevention Security incident response Firewall administration Vulnerability assessment Security policies and procedures Log analysis Ethical hacking Problem-solving Communication skills Attention to detail\n  Responsibilities: Manage and secure computer networks, including firewalls and intrusion detection systems. Monitor network traffic for security threats. Implement security policies and procedures.\n  "
    },
    {
        "Experience":"1 to 9 Years",
        "Qualifications":"MCA",
        "Salary Range":"$57K-$98K",
        "Job Title":"Account Manager",
        "Role":"Sales Account Manager",
        "Job Description":"A Sales Account Manager is responsible for building and maintaining relationships with clients, identifying their needs, and proposing tailored solutions to achieve sales targets.",
        "skills":"Account management Sales strategy Negotiation and closing skills",
        "Responsibilities":"Manage sales accounts and ensure revenue growth. Identify cross-selling and upselling opportunities. Develop account strategies and forecasts.",
        "Summary":"\n  Job Tile: Account Manager\n  Job Description: A Sales Account Manager is responsible for building and maintaining relationships with clients, identifying their needs, and proposing tailored solutions to achieve sales targets.\n  Qualification: MCA\n  Experience: 1 to 9 Years\n  Skills: Account management Sales strategy Negotiation and closing skills\n  Responsibilities: Manage sales accounts and ensure revenue growth. Identify cross-selling and upselling opportunities. Develop account strategies and forecasts.\n  "
    },
    {
        "Experience":"4 to 12 Years",
        "Qualifications":"M.Com",
        "Salary Range":"$65K-$100K",
        "Job Title":"Brand Manager",
        "Role":"Product Brand Manager",
        "Job Description":"A Product Brand Manager focuses on promoting and managing the brand identity of specific products or product lines within a companys portfolio.",
        "skills":"Product branding and marketing Product lifecycle management Cross-functional team collaboration Product launch planning Market segmentation and targeting",
        "Responsibilities":"Manage the branding of specific products or product lines. Create product launch plans and marketing campaigns. Ensure consistent product messaging and brand representation.",
        "Summary":"\n  Job Tile: Brand Manager\n  Job Description: A Product Brand Manager focuses on promoting and managing the brand identity of specific products or product lines within a companys portfolio.\n  Qualification: M.Com\n  Experience: 4 to 12 Years\n  Skills: Product branding and marketing Product lifecycle management Cross-functional team collaboration Product launch planning Market segmentation and targeting\n  Responsibilities: Manage the branding of specific products or product lines. Create product launch plans and marketing campaigns. Ensure consistent product messaging and brand representation.\n  "
    },
    {
        "Experience":"5 to 14 Years",
        "Qualifications":"M.Tech",
        "Salary Range":"$60K-$83K",
        "Job Title":"Social Worker",
        "Role":"School Social Worker",
        "Job Description":"Support students social and emotional well-being in schools, collaborate with educators, and connect families with resources.",
        "skills":"School social work principles Student assessment and intervention Special education laws Individualized education plans (IEPs) Crisis management Collaboration with educators Family engagement Advocacy Empathy and communication Documentation Cultural competence Licensing and certification",
        "Responsibilities":"Collaborate with schools to support students academic and social needs. Conduct assessments and provide counseling and resources. Advocate for students and families.",
        "Summary":"\n  Job Tile: Social Worker\n  Job Description: Support students social and emotional well-being in schools, collaborate with educators, and connect families with resources.\n  Qualification: M.Tech\n  Experience: 5 to 14 Years\n  Skills: School social work principles Student assessment and intervention Special education laws Individualized education plans (IEPs) Crisis management Collaboration with educators Family engagement Advocacy Empathy and communication Documentation Cultural competence Licensing and certification\n  Responsibilities: Collaborate with schools to support students academic and social needs. Conduct assessments and provide counseling and resources. Advocate for students and families.\n  "
    },
    {
        "Experience":"0 to 11 Years",
        "Qualifications":"BA",
        "Salary Range":"$55K-$117K",
        "Job Title":"Social Media Coordinator",
        "Role":"Content Creator",
        "Job Description":"Create engaging and relevant content, such as articles, videos, or social media posts, to promote brands or products.",
        "skills":"Content creation (e.g., writing, editing, graphic design, video production) Content marketing Social media management SEO optimization Creative storytelling Audience engagement Analytics and reporting Adaptability Communication skills Creativity",
        "Responsibilities":"Create compelling and shareable content for social media platforms, including text, images, and videos. Collaborate with designers and photographers for visuals. Engage with the audience and respond to comments.",
        "Summary":"\n  Job Tile: Social Media Coordinator\n  Job Description: Create engaging and relevant content, such as articles, videos, or social media posts, to promote brands or products.\n  Qualification: BA\n  Experience: 0 to 11 Years\n  Skills: Content creation (e.g., writing, editing, graphic design, video production) Content marketing Social media management SEO optimization Creative storytelling Audience engagement Analytics and reporting Adaptability Communication skills Creativity\n  Responsibilities: Create compelling and shareable content for social media platforms, including text, images, and videos. Collaborate with designers and photographers for visuals. Engage with the audience and respond to comments.\n  "
    },
    {
        "Experience":"3 to 12 Years",
        "Qualifications":"BA",
        "Salary Range":"$55K-$121K",
        "Job Title":"Email Marketing Specialist",
        "Role":"Deliverability Analyst",
        "Job Description":"Monitor and improve email deliverability rates, troubleshoot delivery issues, and maintain a clean email list.",
        "skills":"Email deliverability best practices Spam filter testing List hygiene Blacklist monitoring Email authentication (e.g., SPF, DKIM) Deliverability metrics analysis Troubleshooting deliverability issues Communication skills Data analysis Attention to detail",
        "Responsibilities":"Focus on email deliverability, monitoring email sender reputation and list quality. Troubleshoot email delivery issues and maintain sender compliance. Implement best practices for inbox placement.",
        "Summary":"\n  Job Tile: Email Marketing Specialist\n  Job Description: Monitor and improve email deliverability rates, troubleshoot delivery issues, and maintain a clean email list.\n  Qualification: BA\n  Experience: 3 to 12 Years\n  Skills: Email deliverability best practices Spam filter testing List hygiene Blacklist monitoring Email authentication (e.g., SPF, DKIM) Deliverability metrics analysis Troubleshooting deliverability issues Communication skills Data analysis Attention to detail\n  Responsibilities: Focus on email deliverability, monitoring email sender reputation and list quality. Troubleshoot email delivery issues and maintain sender compliance. Implement best practices for inbox placement.\n  "
    },
    {
        "Experience":"5 to 9 Years",
        "Qualifications":"PhD",
        "Salary Range":"$65K-$128K",
        "Job Title":"HR Generalist",
        "Role":"HR Coordinator",
        "Job Description":"HR Coordinators assist in HR functions such as recruitment, onboarding, and employee record maintenance. They often handle administrative tasks, organize training programs, and provide support to the HR department in various ways.",
        "skills":"Human resources Recruitment Employee onboarding HRIS (HR Information Systems) Record keeping Communication skills",
        "Responsibilities":"Assist with recruitment activities, including posting job openings, coordinating interviews, and managing applicant data. Ensure a positive candidate experience. Maintain recruitment records and metrics.",
        "Summary":"\n  Job Tile: HR Generalist\n  Job Description: HR Coordinators assist in HR functions such as recruitment, onboarding, and employee record maintenance. They often handle administrative tasks, organize training programs, and provide support to the HR department in various ways.\n  Qualification: PhD\n  Experience: 5 to 9 Years\n  Skills: Human resources Recruitment Employee onboarding HRIS (HR Information Systems) Record keeping Communication skills\n  Responsibilities: Assist with recruitment activities, including posting job openings, coordinating interviews, and managing applicant data. Ensure a positive candidate experience. Maintain recruitment records and metrics.\n  "
    },
    {
        "Experience":"0 to 15 Years",
        "Qualifications":"B.Tech",
        "Salary Range":"$62K-$120K",
        "Job Title":"Legal Assistant",
        "Role":"Legal Secretary",
        "Job Description":"Provide administrative support to legal professionals, manage schedules, draft documents, and handle correspondence.",
        "skills":"Legal administrative tasks Document management Calendar and docketing Transcription File organization Communication with clients and courts Knowledge of legal terminology Attention to detail Multitasking Computer skills (e.g., MS Office)",
        "Responsibilities":"Provide administrative support to legal professionals, including scheduling appointments and managing calendars. Prepare legal correspondence and forms. Maintain legal databases and records.",
        "Summary":"\n  Job Tile: Legal Assistant\n  Job Description: Provide administrative support to legal professionals, manage schedules, draft documents, and handle correspondence.\n  Qualification: B.Tech\n  Experience: 0 to 15 Years\n  Skills: Legal administrative tasks Document management Calendar and docketing Transcription File organization Communication with clients and courts Knowledge of legal terminology Attention to detail Multitasking Computer skills (e.g., MS Office)\n  Responsibilities: Provide administrative support to legal professionals, including scheduling appointments and managing calendars. Prepare legal correspondence and forms. Maintain legal databases and records.\n  "
    },
    {
        "Experience":"0 to 10 Years",
        "Qualifications":"BCA",
        "Salary Range":"$64K-$98K",
        "Job Title":"Nurse Practitioner",
        "Role":"Family Nurse Practitioner",
        "Job Description":"Family Nurse Practitioners specialize in family-centered healthcare, providing comprehensive medical care to individuals of all ages within a family context.",
        "skills":"Family medicine Health assessment Pediatric care Chronic disease management Patient education",
        "Responsibilities":"Focus on family-centered care, providing healthcare services to individuals and families of all ages. Perform physical exams, order diagnostic tests, and manage chronic conditions. Promote health and wellness.",
        "Summary":"\n  Job Tile: Nurse Practitioner\n  Job Description: Family Nurse Practitioners specialize in family-centered healthcare, providing comprehensive medical care to individuals of all ages within a family context.\n  Qualification: BCA\n  Experience: 0 to 10 Years\n  Skills: Family medicine Health assessment Pediatric care Chronic disease management Patient education\n  Responsibilities: Focus on family-centered care, providing healthcare services to individuals and families of all ages. Perform physical exams, order diagnostic tests, and manage chronic conditions. Promote health and wellness.\n  "
    },
    {
        "Experience":"1 to 8 Years",
        "Qualifications":"M.Tech",
        "Salary Range":"$58K-$116K",
        "Job Title":"Account Director",
        "Role":"Account Strategist",
        "Job Description":"Account Strategists work in advertising or marketing agencies, managing client accounts. They develop strategies to meet client goals, oversee campaign execution, and maintain client satisfaction by providing expert guidance and solutions.",
        "skills":"Account management Client relations Marketing strategies Campaign optimization Data analysis Communication skills",
        "Responsibilities":"Develop account strategies and marketing plans to achieve client objectives. Analyze campaign performance data and provide strategic recommendations. Collaborate with cross-functional teams.",
        "Summary":"\n  Job Tile: Account Director\n  Job Description: Account Strategists work in advertising or marketing agencies, managing client accounts. They develop strategies to meet client goals, oversee campaign execution, and maintain client satisfaction by providing expert guidance and solutions.\n  Qualification: M.Tech\n  Experience: 1 to 8 Years\n  Skills: Account management Client relations Marketing strategies Campaign optimization Data analysis Communication skills\n  Responsibilities: Develop account strategies and marketing plans to achieve client objectives. Analyze campaign performance data and provide strategic recommendations. Collaborate with cross-functional teams.\n  "
    },
    {
        "Experience":"2 to 14 Years",
        "Qualifications":"PhD",
        "Salary Range":"$62K-$124K",
        "Job Title":"Software Engineer",
        "Role":"Backend Developer",
        "Job Description":"A Backend Developer is tasked with building and maintaining the server-side logic and database infrastructure of web applications. They work on the core functionality, data storage, and server communication to ensure the application runs smoothly and efficiently.",
        "skills":"Proficiency in one or more backend programming languages (e.g., Java, Python, Node.js, Ruby) API development Database management (SQL or NoSQL) Server management and deployment Security best practices Knowledge of web frameworks (e.g., Express, Django)",
        "Responsibilities":"Develop server-side logic and databases using programming languages like Java, Python, or Node.js. Ensure data security and integrity. Implement APIs for seamless communication between frontend and backend.",
        "Summary":"\n  Job Tile: Software Engineer\n  Job Description: A Backend Developer is tasked with building and maintaining the server-side logic and database infrastructure of web applications. They work on the core functionality, data storage, and server communication to ensure the application runs smoothly and efficiently.\n  Qualification: PhD\n  Experience: 2 to 14 Years\n  Skills: Proficiency in one or more backend programming languages (e.g., Java, Python, Node.js, Ruby) API development Database management (SQL or NoSQL) Server management and deployment Security best practices Knowledge of web frameworks (e.g., Express, Django)\n  Responsibilities: Develop server-side logic and databases using programming languages like Java, Python, or Node.js. Ensure data security and integrity. Implement APIs for seamless communication between frontend and backend.\n  "
    },
    {
        "Experience":"3 to 9 Years",
        "Qualifications":"MBA",
        "Salary Range":"$60K-$104K",
        "Job Title":"Purchasing Agent",
        "Role":"Supply Chain Coordinator",
        "Job Description":"A Supply Chain Coordinator manages supply chain operations, coordinates logistics, and ensures the seamless flow of goods and materials throughout the supply chain network.",
        "skills":"Supply chain logistics Inventory management Communication skills Problem-solving Vendor coordination",
        "Responsibilities":"Coordinate supply chain activities, including logistics, transportation, and demand planning. Collaborate with suppliers and distribution partners. Monitor and improve supply chain efficiency.",
        "Summary":"\n  Job Tile: Purchasing Agent\n  Job Description: A Supply Chain Coordinator manages supply chain operations, coordinates logistics, and ensures the seamless flow of goods and materials throughout the supply chain network.\n  Qualification: MBA\n  Experience: 3 to 9 Years\n  Skills: Supply chain logistics Inventory management Communication skills Problem-solving Vendor coordination\n  Responsibilities: Coordinate supply chain activities, including logistics, transportation, and demand planning. Collaborate with suppliers and distribution partners. Monitor and improve supply chain efficiency.\n  "
    },
    {
        "Experience":"5 to 15 Years",
        "Qualifications":"M.Tech",
        "Salary Range":"$59K-$88K",
        "Job Title":"Sales Consultant",
        "Role":"B2B Sales Consultant",
        "Job Description":"B2B Sales Consultants specialize in business-to-business sales. They identify and target potential corporate clients, negotiate contracts, and build long-term relationships to drive sales growth in the B2B market.",
        "skills":"B2B sales Business-to-business sales strategies Lead generation Sales negotiations Client relationship building Market research",
        "Responsibilities":"Specialize in business-to-business (B2B) sales, targeting corporate clients. Build and maintain long-term relationships with key clients. Negotiate and close complex sales deals.",
        "Summary":"\n  Job Tile: Sales Consultant\n  Job Description: B2B Sales Consultants specialize in business-to-business sales. They identify and target potential corporate clients, negotiate contracts, and build long-term relationships to drive sales growth in the B2B market.\n  Qualification: M.Tech\n  Experience: 5 to 15 Years\n  Skills: B2B sales Business-to-business sales strategies Lead generation Sales negotiations Client relationship building Market research\n  Responsibilities: Specialize in business-to-business (B2B) sales, targeting corporate clients. Build and maintain long-term relationships with key clients. Negotiate and close complex sales deals.\n  "
    },
    {
        "Experience":"4 to 15 Years",
        "Qualifications":"BA",
        "Salary Range":"$64K-$100K",
        "Job Title":"Civil Engineer",
        "Role":"Structural Engineer",
        "Job Description":"A Structural Engineer designs and analyzes the structural integrity of buildings, bridges, and other structures. They ensure safety and compliance with engineering standards.",
        "skills":"Structural engineering principles Structural analysis and design software (e.g., AutoCAD, SAP2000) Building codes and standards Project management Structural integrity assessment",
        "Responsibilities":"Design and analyze structural components and systems for buildings and infrastructure projects. Ensure structural safety and compliance with codes and standards. Collaborate with architects and contractors.",
        "Summary":"\n  Job Tile: Civil Engineer\n  Job Description: A Structural Engineer designs and analyzes the structural integrity of buildings, bridges, and other structures. They ensure safety and compliance with engineering standards.\n  Qualification: BA\n  Experience: 4 to 15 Years\n  Skills: Structural engineering principles Structural analysis and design software (e.g., AutoCAD, SAP2000) Building codes and standards Project management Structural integrity assessment\n  Responsibilities: Design and analyze structural components and systems for buildings and infrastructure projects. Ensure structural safety and compliance with codes and standards. Collaborate with architects and contractors.\n  "
    },
    {
        "Experience":"0 to 12 Years",
        "Qualifications":"M.Com",
        "Salary Range":"$63K-$86K",
        "Job Title":"Network Security Specialist",
        "Role":"Security Operations Center (SOC) Analyst",
        "Job Description":"SOC Analysts work in security operations centers. They monitor and respond to security incidents, analyze threats, and implement security protocols to protect an organizations assets.",
        "skills":"SOC operations Security incident response Threat detection Log analysis Security tools (e.g., IDS\/IPS) Security alerts triage",
        "Responsibilities":"Work in SOC teams to monitor and respond to security incidents. Investigate and analyze security alerts and incidents. Maintain security documentation and incident reports.",
        "Summary":"\n  Job Tile: Network Security Specialist\n  Job Description: SOC Analysts work in security operations centers. They monitor and respond to security incidents, analyze threats, and implement security protocols to protect an organizations assets.\n  Qualification: M.Com\n  Experience: 0 to 12 Years\n  Skills: SOC operations Security incident response Threat detection Log analysis Security tools (e.g., IDS\/IPS) Security alerts triage\n  Responsibilities: Work in SOC teams to monitor and respond to security incidents. Investigate and analyze security alerts and incidents. Maintain security documentation and incident reports.\n  "
    },
    {
        "Experience":"2 to 10 Years",
        "Qualifications":"BBA",
        "Salary Range":"$65K-$119K",
        "Job Title":"UI Developer",
        "Role":"Front-End Developer",
        "Job Description":"A Front-End Developer specializes in creating the user interface and user experience of websites or applications. They code and design elements that users interact with directly.",
        "skills":"Front-end web development HTML, CSS, JavaScript Responsive design Web performance optimization Cross-browser compatibility",
        "Responsibilities":"Develop and maintain user interfaces for websites and web applications. Write clean and efficient HTML, CSS, and JavaScript code. Collaborate with UX designers to ensure a seamless user experience.",
        "Summary":"\n  Job Tile: UI Developer\n  Job Description: A Front-End Developer specializes in creating the user interface and user experience of websites or applications. They code and design elements that users interact with directly.\n  Qualification: BBA\n  Experience: 2 to 10 Years\n  Skills: Front-end web development HTML, CSS, JavaScript Responsive design Web performance optimization Cross-browser compatibility\n  Responsibilities: Develop and maintain user interfaces for websites and web applications. Write clean and efficient HTML, CSS, and JavaScript code. Collaborate with UX designers to ensure a seamless user experience.\n  "
    },
    {
        "Experience":"4 to 8 Years",
        "Qualifications":"BA",
        "Salary Range":"$55K-$83K",
        "Job Title":"Financial Planner",
        "Role":"Tax Planner",
        "Job Description":"Assist clients with tax planning, minimize tax liabilities, and stay up-to-date with tax laws and regulations.",
        "skills":"Tax planning strategies Tax law knowledge Financial analysis Retirement planning Estate planning Client relationship management Tax optimization Communication skills Attention to detail Tax software proficiency Regulatory compliance",
        "Responsibilities":"Focus on tax planning and optimization, helping clients minimize tax liabilities. Stay updated on tax laws and regulations. Provide tax-efficient financial strategies.",
        "Summary":"\n  Job Tile: Financial Planner\n  Job Description: Assist clients with tax planning, minimize tax liabilities, and stay up-to-date with tax laws and regulations.\n  Qualification: BA\n  Experience: 4 to 8 Years\n  Skills: Tax planning strategies Tax law knowledge Financial analysis Retirement planning Estate planning Client relationship management Tax optimization Communication skills Attention to detail Tax software proficiency Regulatory compliance\n  Responsibilities: Focus on tax planning and optimization, helping clients minimize tax liabilities. Stay updated on tax laws and regulations. Provide tax-efficient financial strategies.\n  "
    },
    {
        "Experience":"3 to 8 Years",
        "Qualifications":"BA",
        "Salary Range":"$65K-$115K",
        "Job Title":"Event Planner",
        "Role":"Event Coordinator",
        "Job Description":"Event Coordinators plan and execute various events, including conferences, parties, and meetings, managing logistics, budgets, and vendor relationships.",
        "skills":"Event planning Vendor coordination Budget management Marketing and promotion Logistics",
        "Responsibilities":"Plan and coordinate events, including logistics, vendor management, and timelines. Communicate with clients to understand event goals and preferences. Ensure smooth event execution.",
        "Summary":"\n  Job Tile: Event Planner\n  Job Description: Event Coordinators plan and execute various events, including conferences, parties, and meetings, managing logistics, budgets, and vendor relationships.\n  Qualification: BA\n  Experience: 3 to 8 Years\n  Skills: Event planning Vendor coordination Budget management Marketing and promotion Logistics\n  Responsibilities: Plan and coordinate events, including logistics, vendor management, and timelines. Communicate with clients to understand event goals and preferences. Ensure smooth event execution.\n  "
    },
    {
        "Experience":"1 to 14 Years",
        "Qualifications":"M.Com",
        "Salary Range":"$57K-$121K",
        "Job Title":"Psychologist",
        "Role":"Clinical Psychologist",
        "Job Description":"Clinical Psychologists diagnose and treat mental health disorders. They conduct therapy sessions, assessments, and research to improve patients well-being.",
        "skills":"Clinical psychology Counseling skills Assessment tools Diagnostic skills Empathy and listening skills",
        "Responsibilities":"Provide therapy and counseling services to individuals, couples, and families. Conduct psychological assessments and diagnoses. Develop treatment plans and provide ongoing support.",
        "Summary":"\n  Job Tile: Psychologist\n  Job Description: Clinical Psychologists diagnose and treat mental health disorders. They conduct therapy sessions, assessments, and research to improve patients well-being.\n  Qualification: M.Com\n  Experience: 1 to 14 Years\n  Skills: Clinical psychology Counseling skills Assessment tools Diagnostic skills Empathy and listening skills\n  Responsibilities: Provide therapy and counseling services to individuals, couples, and families. Conduct psychological assessments and diagnoses. Develop treatment plans and provide ongoing support.\n  "
    },
    {
        "Experience":"1 to 13 Years",
        "Qualifications":"B.Com",
        "Salary Range":"$65K-$82K",
        "Job Title":"Electrical Designer",
        "Role":"Electrical Engineer",
        "Job Description":"Electrical Engineers design and develop electrical systems and devices. They work on projects such as power generation, electronics, and control systems for various industries.",
        "skills":"Electrical engineering Circuit design Electronics AutoCAD proficiency Problem-solving",
        "Responsibilities":"Design electrical systems and components for buildings and infrastructure projects. Ensure compliance with electrical codes and safety standards. Collaborate with architects and contractors.",
        "Summary":"\n  Job Tile: Electrical Designer\n  Job Description: Electrical Engineers design and develop electrical systems and devices. They work on projects such as power generation, electronics, and control systems for various industries.\n  Qualification: B.Com\n  Experience: 1 to 13 Years\n  Skills: Electrical engineering Circuit design Electronics AutoCAD proficiency Problem-solving\n  Responsibilities: Design electrical systems and components for buildings and infrastructure projects. Ensure compliance with electrical codes and safety standards. Collaborate with architects and contractors.\n  "
    },
    {
        "Experience":"3 to 10 Years",
        "Qualifications":"M.Com",
        "Salary Range":"$58K-$129K",
        "Job Title":"Data Analyst",
        "Role":"Business Intelligence Analyst",
        "Job Description":"Business Intelligence Analysts gather and analyze data to provide valuable insights to support decision-making within an organization. They create reports, dashboards, and data visualizations to help stakeholders understand trends, patterns, and opportunities in the data.",
        "skills":"Data analysis and visualization tools (e.g., Tableau, Power BI) SQL and database querying Business intelligence concepts Data modeling and reporting Strong analytical and problem-solving skills Data-driven decision-making",
        "Responsibilities":"Gather and analyze data to provide insights for decision-making using tools like Tableau or Power BI. Create data visualizations and reports. Identify trends and patterns in data.",
        "Summary":"\n  Job Tile: Data Analyst\n  Job Description: Business Intelligence Analysts gather and analyze data to provide valuable insights to support decision-making within an organization. They create reports, dashboards, and data visualizations to help stakeholders understand trends, patterns, and opportunities in the data.\n  Qualification: M.Com\n  Experience: 3 to 10 Years\n  Skills: Data analysis and visualization tools (e.g., Tableau, Power BI) SQL and database querying Business intelligence concepts Data modeling and reporting Strong analytical and problem-solving skills Data-driven decision-making\n  Responsibilities: Gather and analyze data to provide insights for decision-making using tools like Tableau or Power BI. Create data visualizations and reports. Identify trends and patterns in data.\n  "
    },
    {
        "Experience":"0 to 12 Years",
        "Qualifications":"PhD",
        "Salary Range":"$60K-$89K",
        "Job Title":"Technical Writer",
        "Role":"Content Writer",
        "Job Description":"Content Writers create written content for various platforms. They produce articles, blog posts, and web content to inform, educate, or entertain audiences.",
        "skills":"Writing skills Content creation SEO knowledge Research skills Grammar and proofreading",
        "Responsibilities":"Write informative and engaging content for websites, blogs, and marketing materials. Conduct research and interviews to gather information. Tailor content to target audiences.",
        "Summary":"\n  Job Tile: Technical Writer\n  Job Description: Content Writers create written content for various platforms. They produce articles, blog posts, and web content to inform, educate, or entertain audiences.\n  Qualification: PhD\n  Experience: 0 to 12 Years\n  Skills: Writing skills Content creation SEO knowledge Research skills Grammar and proofreading\n  Responsibilities: Write informative and engaging content for websites, blogs, and marketing materials. Conduct research and interviews to gather information. Tailor content to target audiences.\n  "
    },
    {
        "Experience":"4 to 12 Years",
        "Qualifications":"M.Com",
        "Salary Range":"$57K-$100K",
        "Job Title":"Tax Consultant",
        "Role":"Personal Tax Consultant",
        "Job Description":"A Personal Tax Consultant provides tax planning and preparation services to individuals. They help clients optimize their tax situations while ensuring compliance with tax laws.",
        "skills":"Tax law knowledge Individual tax planning Tax return preparation Tax deductions and credits Tax compliance IRS regulations Client relationship management Communication skills Attention to detail Tax software proficiency",
        "Responsibilities":"Assist individuals and families with personal income tax planning and compliance. Prepare and file tax returns. Provide tax advice and financial planning.",
        "Summary":"\n  Job Tile: Tax Consultant\n  Job Description: A Personal Tax Consultant provides tax planning and preparation services to individuals. They help clients optimize their tax situations while ensuring compliance with tax laws.\n  Qualification: M.Com\n  Experience: 4 to 12 Years\n  Skills: Tax law knowledge Individual tax planning Tax return preparation Tax deductions and credits Tax compliance IRS regulations Client relationship management Communication skills Attention to detail Tax software proficiency\n  Responsibilities: Assist individuals and families with personal income tax planning and compliance. Prepare and file tax returns. Provide tax advice and financial planning.\n  "
    },
    {
        "Experience":"5 to 14 Years",
        "Qualifications":"BCA",
        "Salary Range":"$56K-$109K",
        "Job Title":"Account Executive",
        "Role":"Sales Account Executive",
        "Job Description":"A Sales Account Executive is responsible for acquiring and managing business accounts. They identify sales opportunities, negotiate contracts, and meet revenue targets.",
        "skills":"Sales strategies and tactics Account management Relationship building Sales forecasting Industry and product knowledge",
        "Responsibilities":"Identify and pursue sales opportunities with new and existing clients. Build and maintain client relationships. Meet or exceed sales targets and quotas.",
        "Summary":"\n  Job Tile: Account Executive\n  Job Description: A Sales Account Executive is responsible for acquiring and managing business accounts. They identify sales opportunities, negotiate contracts, and meet revenue targets.\n  Qualification: BCA\n  Experience: 5 to 14 Years\n  Skills: Sales strategies and tactics Account management Relationship building Sales forecasting Industry and product knowledge\n  Responsibilities: Identify and pursue sales opportunities with new and existing clients. Build and maintain client relationships. Meet or exceed sales targets and quotas.\n  "
    },
    {
        "Experience":"2 to 13 Years",
        "Qualifications":"BCA",
        "Salary Range":"$55K-$121K",
        "Job Title":"Systems Administrator",
        "Role":"IT Support Specialist",
        "Job Description":"IT Support Specialists provide technical assistance to end-users, troubleshooting hardware and software problems, setting up equipment, and maintaining IT infrastructure.",
        "skills":"Technical troubleshooting Hardware and software support Customer service Problem-solving Communication",
        "Responsibilities":"Provide technical support to end-users, troubleshoot hardware and software issues, and resolve IT-related problems. Install and configure computer systems and software. Maintain IT documentation and knowledge base.",
        "Summary":"\n  Job Tile: Systems Administrator\n  Job Description: IT Support Specialists provide technical assistance to end-users, troubleshooting hardware and software problems, setting up equipment, and maintaining IT infrastructure.\n  Qualification: BCA\n  Experience: 2 to 13 Years\n  Skills: Technical troubleshooting Hardware and software support Customer service Problem-solving Communication\n  Responsibilities: Provide technical support to end-users, troubleshoot hardware and software issues, and resolve IT-related problems. Install and configure computer systems and software. Maintain IT documentation and knowledge base.\n  "
    },
    {
        "Experience":"1 to 15 Years",
        "Qualifications":"BBA",
        "Salary Range":"$56K-$82K",
        "Job Title":"Database Administrator",
        "Role":"Database Developer",
        "Job Description":"A Database Developer designs, develops, and maintains databases. They create efficient data structures, write queries, and ensure data security and integrity.",
        "skills":"Database design and development SQL and database querying Data modeling Programming languages (e.g., Java, Python) Data security and privacy regulations knowledge",
        "Responsibilities":"Design and implement database systems, tables, and structures. Develop and optimize SQL queries and scripts. Ensure data security, integrity, and backup procedures.",
        "Summary":"\n  Job Tile: Database Administrator\n  Job Description: A Database Developer designs, develops, and maintains databases. They create efficient data structures, write queries, and ensure data security and integrity.\n  Qualification: BBA\n  Experience: 1 to 15 Years\n  Skills: Database design and development SQL and database querying Data modeling Programming languages (e.g., Java, Python) Data security and privacy regulations knowledge\n  Responsibilities: Design and implement database systems, tables, and structures. Develop and optimize SQL queries and scripts. Ensure data security, integrity, and backup procedures.\n  "
    },
    {
        "Experience":"1 to 15 Years",
        "Qualifications":"B.Tech",
        "Salary Range":"$59K-$80K",
        "Job Title":"Research Analyst",
        "Role":"Social Science Researcher",
        "Job Description":"A Social Science Researcher conducts research in fields such as sociology, psychology, or anthropology to study human behavior and social phenomena, contributing to academic knowledge.",
        "skills":"Social science research methods Qualitative and quantitative data analysis Survey design and implementation Ethnographic research Interviewing skills Research ethics Statistical software (e.g., Stata, NVivo) Report writing Communication skills Critical thinking Empathy",
        "Responsibilities":"Conduct research in social sciences, gathering and analyzing data on social phenomena, human behavior, and public policy. Publish research findings in academic journals. Contribute to social science research projects.",
        "Summary":"\n  Job Tile: Research Analyst\n  Job Description: A Social Science Researcher conducts research in fields such as sociology, psychology, or anthropology to study human behavior and social phenomena, contributing to academic knowledge.\n  Qualification: B.Tech\n  Experience: 1 to 15 Years\n  Skills: Social science research methods Qualitative and quantitative data analysis Survey design and implementation Ethnographic research Interviewing skills Research ethics Statistical software (e.g., Stata, NVivo) Report writing Communication skills Critical thinking Empathy\n  Responsibilities: Conduct research in social sciences, gathering and analyzing data on social phenomena, human behavior, and public policy. Publish research findings in academic journals. Contribute to social science research projects.\n  "
    },
    {
        "Experience":"3 to 9 Years",
        "Qualifications":"B.Tech",
        "Salary Range":"$56K-$109K",
        "Job Title":"Data Entry Clerk",
        "Role":"Record Keeper",
        "Job Description":"A Record Keeper is responsible for maintaining accurate records and databases, ensuring data integrity, and assisting in data retrieval when needed.",
        "skills":"Records management Data entry and retrieval Attention to detail",
        "Responsibilities":"Maintain records, files, and documentation in an organized manner. Ensure compliance with record-keeping policies and regulations. Retrieve and update records as needed.",
        "Summary":"\n  Job Tile: Data Entry Clerk\n  Job Description: A Record Keeper is responsible for maintaining accurate records and databases, ensuring data integrity, and assisting in data retrieval when needed.\n  Qualification: B.Tech\n  Experience: 3 to 9 Years\n  Skills: Records management Data entry and retrieval Attention to detail\n  Responsibilities: Maintain records, files, and documentation in an organized manner. Ensure compliance with record-keeping policies and regulations. Retrieve and update records as needed.\n  "
    },
    {
        "Experience":"5 to 14 Years",
        "Qualifications":"MCA",
        "Salary Range":"$64K-$130K",
        "Job Title":"Registered Nurse",
        "Role":"Staff Nurse",
        "Job Description":"A Staff Nurse provides patient care, administers medications, and collaborates with healthcare teams to ensure the well-being of patients in clinical settings.",
        "skills":"Nursing care Patient assessment Medical knowledge",
        "Responsibilities":"Provide direct patient care, including assessments, medication administration, and wound care. Monitor patient conditions and vital signs. Collaborate with healthcare teams to develop care plans.",
        "Summary":"\n  Job Tile: Registered Nurse\n  Job Description: A Staff Nurse provides patient care, administers medications, and collaborates with healthcare teams to ensure the well-being of patients in clinical settings.\n  Qualification: MCA\n  Experience: 5 to 14 Years\n  Skills: Nursing care Patient assessment Medical knowledge\n  Responsibilities: Provide direct patient care, including assessments, medication administration, and wound care. Monitor patient conditions and vital signs. Collaborate with healthcare teams to develop care plans.\n  "
    },
    {
        "Experience":"4 to 8 Years",
        "Qualifications":"MCA",
        "Salary Range":"$57K-$97K",
        "Job Title":"Investment Analyst",
        "Role":"Risk Analyst",
        "Job Description":"A Risk Analyst assesses and manages financial risks within an organization. They use data analysis and modeling to evaluate potential risks and recommend mitigation strategies.",
        "skills":"Risk assessment Data analysis Financial modeling Risk management tools Regulatory compliance knowledge",
        "Responsibilities":"Evaluate investment risks, including market, credit, and operational risks. Develop risk models and stress tests. Implement risk management strategies and controls.",
        "Summary":"\n  Job Tile: Investment Analyst\n  Job Description: A Risk Analyst assesses and manages financial risks within an organization. They use data analysis and modeling to evaluate potential risks and recommend mitigation strategies.\n  Qualification: MCA\n  Experience: 4 to 8 Years\n  Skills: Risk assessment Data analysis Financial modeling Risk management tools Regulatory compliance knowledge\n  Responsibilities: Evaluate investment risks, including market, credit, and operational risks. Develop risk models and stress tests. Implement risk management strategies and controls.\n  "
    },
    {
        "Experience":"5 to 10 Years",
        "Qualifications":"M.Com",
        "Salary Range":"$62K-$127K",
        "Job Title":"Speech Therapist",
        "Role":"Speech Pathologist",
        "Job Description":"Speech Pathologists diagnose and treat speech, language, and swallowing disorders in patients of all ages. They develop personalized treatment plans to improve communication.",
        "skills":"Speech pathology Articulation therapy Language disorders Speech assessment Therapy planning Communication skills",
        "Responsibilities":"Diagnose and treat a wide range of speech and language disorders across age groups. Use assessment tools and therapeutic techniques. Help individuals improve their communication abilities.",
        "Summary":"\n  Job Tile: Speech Therapist\n  Job Description: Speech Pathologists diagnose and treat speech, language, and swallowing disorders in patients of all ages. They develop personalized treatment plans to improve communication.\n  Qualification: M.Com\n  Experience: 5 to 10 Years\n  Skills: Speech pathology Articulation therapy Language disorders Speech assessment Therapy planning Communication skills\n  Responsibilities: Diagnose and treat a wide range of speech and language disorders across age groups. Use assessment tools and therapeutic techniques. Help individuals improve their communication abilities.\n  "
    },
    {
        "Experience":"4 to 8 Years",
        "Qualifications":"B.Com",
        "Salary Range":"$55K-$105K",
        "Job Title":"Sales Manager",
        "Role":"Regional Sales Director",
        "Job Description":"Oversee sales operations within a specific region, develop sales plans, and manage regional sales teams.",
        "skills":"Sales strategy development Territory management Sales team leadership",
        "Responsibilities":"Oversee sales activities and strategy for a specific geographic region. Develop sales plans and objectives. Analyze regional market trends and competition.",
        "Summary":"\n  Job Tile: Sales Manager\n  Job Description: Oversee sales operations within a specific region, develop sales plans, and manage regional sales teams.\n  Qualification: B.Com\n  Experience: 4 to 8 Years\n  Skills: Sales strategy development Territory management Sales team leadership\n  Responsibilities: Oversee sales activities and strategy for a specific geographic region. Develop sales plans and objectives. Analyze regional market trends and competition.\n  "
    },
    {
        "Experience":"0 to 13 Years",
        "Qualifications":"B.Com",
        "Salary Range":"$64K-$92K",
        "Job Title":"Landscape Architect",
        "Role":"Urban Planner",
        "Job Description":"Develop and implement urban planning strategies, manage land use, and ensure sustainable city development.",
        "skills":"Urban design and planning Zoning regulations GIS and mapping tools",
        "Responsibilities":"Plan and design urban spaces, parks, and recreational areas. Consider sustainability and community needs in design. Collaborate with city planners and architects.",
        "Summary":"\n  Job Tile: Landscape Architect\n  Job Description: Develop and implement urban planning strategies, manage land use, and ensure sustainable city development.\n  Qualification: B.Com\n  Experience: 0 to 13 Years\n  Skills: Urban design and planning Zoning regulations GIS and mapping tools\n  Responsibilities: Plan and design urban spaces, parks, and recreational areas. Consider sustainability and community needs in design. Collaborate with city planners and architects.\n  "
    },
    {
        "Experience":"5 to 15 Years",
        "Qualifications":"B.Tech",
        "Salary Range":"$60K-$102K",
        "Job Title":"Key Account Manager",
        "Role":"Strategic Account Manager",
        "Job Description":"Strategic Account Managers nurture relationships with key clients. They develop account strategies, address client needs, and seek opportunities for business growth and expansion.",
        "skills":"Account management Client relationship Sales strategy Business development Negotiation skills",
        "Responsibilities":"Focus on strategic planning for key accounts, identifying long-term goals and growth opportunities. Collaborate with cross-functional teams to meet client needs. Monitor account performance and profitability.",
        "Summary":"\n  Job Tile: Key Account Manager\n  Job Description: Strategic Account Managers nurture relationships with key clients. They develop account strategies, address client needs, and seek opportunities for business growth and expansion.\n  Qualification: B.Tech\n  Experience: 5 to 15 Years\n  Skills: Account management Client relationship Sales strategy Business development Negotiation skills\n  Responsibilities: Focus on strategic planning for key accounts, identifying long-term goals and growth opportunities. Collaborate with cross-functional teams to meet client needs. Monitor account performance and profitability.\n  "
    },
    {
        "Experience":"4 to 14 Years",
        "Qualifications":"B.Tech",
        "Salary Range":"$63K-$109K",
        "Job Title":"UX Researcher",
        "Role":"User Researcher",
        "Job Description":"Conduct user research to understand customer needs, preferences, and behaviors to inform product development.",
        "skills":"User research methods Usability testing Data analysis and interpretation",
        "Responsibilities":"Conduct user research to understand user behavior, needs, and preferences. Plan and execute user interviews, surveys, and usability studies. Analyze research findings and generate insights.",
        "Summary":"\n  Job Tile: UX Researcher\n  Job Description: Conduct user research to understand customer needs, preferences, and behaviors to inform product development.\n  Qualification: B.Tech\n  Experience: 4 to 14 Years\n  Skills: User research methods Usability testing Data analysis and interpretation\n  Responsibilities: Conduct user research to understand user behavior, needs, and preferences. Plan and execute user interviews, surveys, and usability studies. Analyze research findings and generate insights.\n  "
    },
    {
        "Experience":"2 to 10 Years",
        "Qualifications":"B.Com",
        "Salary Range":"$65K-$88K",
        "Job Title":"Investment Banker",
        "Role":"Financial Analyst",
        "Job Description":"A Financial Analyst conducts financial analysis, generates reports, and provides insights to support decision-making, budgeting, and financial planning.",
        "skills":"Financial analysis Data analysis Financial modeling",
        "Responsibilities":"Analyze financial data, research investment opportunities, and provide recommendations for investment decisions. Create financial models and projections. Collaborate with clients on investment strategies.",
        "Summary":"\n  Job Tile: Investment Banker\n  Job Description: A Financial Analyst conducts financial analysis, generates reports, and provides insights to support decision-making, budgeting, and financial planning.\n  Qualification: B.Com\n  Experience: 2 to 10 Years\n  Skills: Financial analysis Data analysis Financial modeling\n  Responsibilities: Analyze financial data, research investment opportunities, and provide recommendations for investment decisions. Create financial models and projections. Collaborate with clients on investment strategies.\n  "
    },
    {
        "Experience":"2 to 9 Years",
        "Qualifications":"BBA",
        "Salary Range":"$65K-$117K",
        "Job Title":"IT Support Specialist",
        "Role":"Desktop Support Technician",
        "Job Description":"Desktop Support Technicians troubleshoot and maintain desktop computer systems, resolving hardware and software problems for users.",
        "skills":"Desktop hardware and software troubleshooting Operating system expertise (e.g., Windows, macOS) Remote desktop support Hardware and software upgrades Customer service skills",
        "Responsibilities":"Install, configure, and maintain desktop computers and peripherals. Perform hardware and software upgrades and repairs. Manage IT inventory and asset tracking.",
        "Summary":"\n  Job Tile: IT Support Specialist\n  Job Description: Desktop Support Technicians troubleshoot and maintain desktop computer systems, resolving hardware and software problems for users.\n  Qualification: BBA\n  Experience: 2 to 9 Years\n  Skills: Desktop hardware and software troubleshooting Operating system expertise (e.g., Windows, macOS) Remote desktop support Hardware and software upgrades Customer service skills\n  Responsibilities: Install, configure, and maintain desktop computers and peripherals. Perform hardware and software upgrades and repairs. Manage IT inventory and asset tracking.\n  "
    },
    {
        "Experience":"3 to 12 Years",
        "Qualifications":"BA",
        "Salary Range":"$61K-$111K",
        "Job Title":"Art Director",
        "Role":"Art Curator",
        "Job Description":"An Art Curator is responsible for managing and preserving a collection of artworks. They curate exhibitions, acquire new pieces, and educate the public about the art.",
        "skills":"Art history and knowledge Art curation and exhibition planning Collections management Art market trends Cultural awareness",
        "Responsibilities":"Curate and manage art collections, exhibitions, and galleries. Research and select artworks for display. Collaborate with artists, collectors, and institutions.",
        "Summary":"\n  Job Tile: Art Director\n  Job Description: An Art Curator is responsible for managing and preserving a collection of artworks. They curate exhibitions, acquire new pieces, and educate the public about the art.\n  Qualification: BA\n  Experience: 3 to 12 Years\n  Skills: Art history and knowledge Art curation and exhibition planning Collections management Art market trends Cultural awareness\n  Responsibilities: Curate and manage art collections, exhibitions, and galleries. Research and select artworks for display. Collaborate with artists, collectors, and institutions.\n  "
    },
    {
        "Experience":"0 to 11 Years",
        "Qualifications":"M.Tech",
        "Salary Range":"$56K-$94K",
        "Job Title":"Software Developer",
        "Role":"Mobile App Developer",
        "Job Description":"Mobile App Developers design and develop mobile applications for various platforms. They collaborate with cross-functional teams to create user-friendly and functional mobile apps that meet user needs.",
        "skills":"Mobile app development languages (e.g., Java, Swift, Kotlin) Cross-platform development (e.g., React Native, Flutter) Mobile app design principles APIs and web services integration Debugging and troubleshooting",
        "Responsibilities":"Create mobile applications for iOS and Android platforms. Optimize mobile app performance and user experience. Collaborate with cross-functional teams to define app requirements.",
        "Summary":"\n  Job Tile: Software Developer\n  Job Description: Mobile App Developers design and develop mobile applications for various platforms. They collaborate with cross-functional teams to create user-friendly and functional mobile apps that meet user needs.\n  Qualification: M.Tech\n  Experience: 0 to 11 Years\n  Skills: Mobile app development languages (e.g., Java, Swift, Kotlin) Cross-platform development (e.g., React Native, Flutter) Mobile app design principles APIs and web services integration Debugging and troubleshooting\n  Responsibilities: Create mobile applications for iOS and Android platforms. Optimize mobile app performance and user experience. Collaborate with cross-functional teams to define app requirements.\n  "
    },
    {
        "Experience":"1 to 11 Years",
        "Qualifications":"BCA",
        "Salary Range":"$65K-$121K",
        "Job Title":"Project Manager",
        "Role":"Agile Project Manager",
        "Job Description":"The Agile Project Manager leads Agile teams, facilitating effective project development and delivery. They use Agile methodologies to manage tasks, prioritize work, and adapt to changing requirements while fostering collaboration among team members.",
        "skills":"Agile methodologies Scrum or Kanban Team collaboration Agile tools (e.g., Jira)",
        "Responsibilities":"Facilitate agile project development, collaborate with cross-functional teams, and manage project backlogs and sprints. Coach and mentor team members on agile practices. Drive continuous improvement of agile processes.",
        "Summary":"\n  Job Tile: Project Manager\n  Job Description: The Agile Project Manager leads Agile teams, facilitating effective project development and delivery. They use Agile methodologies to manage tasks, prioritize work, and adapt to changing requirements while fostering collaboration among team members.\n  Qualification: BCA\n  Experience: 1 to 11 Years\n  Skills: Agile methodologies Scrum or Kanban Team collaboration Agile tools (e.g., Jira)\n  Responsibilities: Facilitate agile project development, collaborate with cross-functional teams, and manage project backlogs and sprints. Coach and mentor team members on agile practices. Drive continuous improvement of agile processes.\n  "
    },
    {
        "Experience":"0 to 8 Years",
        "Qualifications":"BCA",
        "Salary Range":"$55K-$96K",
        "Job Title":"Customer Service Manager",
        "Role":"Service Quality Assurance Manager",
        "Job Description":"Service Quality Assurance Managers monitor and evaluate service quality in an organization. They develop quality standards, conduct audits, analyze customer feedback, and implement improvements to ensure consistent high-quality service delivery.",
        "skills":"Quality assurance Quality control Process improvement Audit procedures Compliance standards Root cause analysis",
        "Responsibilities":"Ensure service quality and consistency by defining and implementing QA standards and processes. Conduct regular quality audits and provide feedback to the team. Identify areas for improvement and training.",
        "Summary":"\n  Job Tile: Customer Service Manager\n  Job Description: Service Quality Assurance Managers monitor and evaluate service quality in an organization. They develop quality standards, conduct audits, analyze customer feedback, and implement improvements to ensure consistent high-quality service delivery.\n  Qualification: BCA\n  Experience: 0 to 8 Years\n  Skills: Quality assurance Quality control Process improvement Audit procedures Compliance standards Root cause analysis\n  Responsibilities: Ensure service quality and consistency by defining and implementing QA standards and processes. Conduct regular quality audits and provide feedback to the team. Identify areas for improvement and training.\n  "
    },
    {
        "Experience":"4 to 13 Years",
        "Qualifications":"MBA",
        "Salary Range":"$59K-$101K",
        "Job Title":"Procurement Manager",
        "Role":"Procurement Analyst",
        "Job Description":"Analyze procurement data, identify cost-saving opportunities, and support the procurement process.",
        "skills":"Procurement processes Vendor assessment Contract negotiation Purchase order management Spend analysis Market research Supplier relationship management Data analysis Problem-solving Attention to detail Communication skills Financial acumen",
        "Responsibilities":"Analyze procurement data and trends to support decision-making. Conduct supplier evaluations and performance assessments. Assist in procurement planning and forecasting.",
        "Summary":"\n  Job Tile: Procurement Manager\n  Job Description: Analyze procurement data, identify cost-saving opportunities, and support the procurement process.\n  Qualification: MBA\n  Experience: 4 to 13 Years\n  Skills: Procurement processes Vendor assessment Contract negotiation Purchase order management Spend analysis Market research Supplier relationship management Data analysis Problem-solving Attention to detail Communication skills Financial acumen\n  Responsibilities: Analyze procurement data and trends to support decision-making. Conduct supplier evaluations and performance assessments. Assist in procurement planning and forecasting.\n  "
    },
    {
        "Experience":"3 to 10 Years",
        "Qualifications":"B.Com",
        "Salary Range":"$63K-$114K",
        "Job Title":"Substance Abuse Counselor",
        "Role":"Family Counselor",
        "Job Description":"A Family Counselor works with families to address interpersonal issues, improve communication, and resolve conflicts, fostering healthier family dynamics.",
        "skills":"Family counseling Marriage and family therapy Conflict resolution skills",
        "Responsibilities":"Work with the families of individuals facing substance abuse challenges. Provide education and therapy to improve family dynamics and support networks. Collaborate with treatment teams.",
        "Summary":"\n  Job Tile: Substance Abuse Counselor\n  Job Description: A Family Counselor works with families to address interpersonal issues, improve communication, and resolve conflicts, fostering healthier family dynamics.\n  Qualification: B.Com\n  Experience: 3 to 10 Years\n  Skills: Family counseling Marriage and family therapy Conflict resolution skills\n  Responsibilities: Work with the families of individuals facing substance abuse challenges. Provide education and therapy to improve family dynamics and support networks. Collaborate with treatment teams.\n  "
    },
    {
        "Experience":"1 to 15 Years",
        "Qualifications":"MCA",
        "Salary Range":"$64K-$82K",
        "Job Title":"Supply Chain Analyst",
        "Role":"Logistics Analyst",
        "Job Description":"A Logistics Analyst analyzes and optimizes logistics and supply chain operations, identifying cost-saving opportunities, improving transportation efficiency, and enhancing supply chain performance.",
        "skills":"Supply chain analysis Data analytics Inventory management Transportation planning Problem-solving",
        "Responsibilities":"Analyze and optimize logistics and supply chain processes, including transportation and warehousing. Monitor inventory levels and track shipments. Identify cost-saving opportunities.",
        "Summary":"\n  Job Tile: Supply Chain Analyst\n  Job Description: A Logistics Analyst analyzes and optimizes logistics and supply chain operations, identifying cost-saving opportunities, improving transportation efficiency, and enhancing supply chain performance.\n  Qualification: MCA\n  Experience: 1 to 15 Years\n  Skills: Supply chain analysis Data analytics Inventory management Transportation planning Problem-solving\n  Responsibilities: Analyze and optimize logistics and supply chain processes, including transportation and warehousing. Monitor inventory levels and track shipments. Identify cost-saving opportunities.\n  "
    },
    {
        "Experience":"0 to 9 Years",
        "Qualifications":"B.Tech",
        "Salary Range":"$56K-$125K",
        "Job Title":"Data Engineer",
        "Role":"Data Architect",
        "Job Description":"A Data Architect designs and manages data infrastructure, ensuring data availability, security, and integrity while aligning data systems with business goals and requirements.",
        "skills":"Data architecture design Database management systems Data modeling",
        "Responsibilities":"Design data architecture and systems to meet business needs. Develop data models and database schemas. Ensure data security and compliance.",
        "Summary":"\n  Job Tile: Data Engineer\n  Job Description: A Data Architect designs and manages data infrastructure, ensuring data availability, security, and integrity while aligning data systems with business goals and requirements.\n  Qualification: B.Tech\n  Experience: 0 to 9 Years\n  Skills: Data architecture design Database management systems Data modeling\n  Responsibilities: Design data architecture and systems to meet business needs. Develop data models and database schemas. Ensure data security and compliance.\n  "
    },
    {
        "Experience":"1 to 8 Years",
        "Qualifications":"BA",
        "Salary Range":"$55K-$87K",
        "Job Title":"Accountant",
        "Role":"Financial Accountant",
        "Job Description":"Financial Accountants handle financial records, prepare financial statements, and ensure compliance with accounting standards. They analyze financial data to provide accurate financial reports and support decision-making within the organization.",
        "skills":"Financial reporting Accounting software (e.g., QuickBooks) Auditing GAAP knowledge",
        "Responsibilities":"Maintain financial records, prepare financial statements, and ensure compliance with accounting standards and regulations. Reconcile accounts and analyze financial data. Assist with financial audits.",
        "Summary":"\n  Job Tile: Accountant\n  Job Description: Financial Accountants handle financial records, prepare financial statements, and ensure compliance with accounting standards. They analyze financial data to provide accurate financial reports and support decision-making within the organization.\n  Qualification: BA\n  Experience: 1 to 8 Years\n  Skills: Financial reporting Accounting software (e.g., QuickBooks) Auditing GAAP knowledge\n  Responsibilities: Maintain financial records, prepare financial statements, and ensure compliance with accounting standards and regulations. Reconcile accounts and analyze financial data. Assist with financial audits.\n  "
    },
    {
        "Experience":"4 to 8 Years",
        "Qualifications":"PhD",
        "Salary Range":"$56K-$101K",
        "Job Title":"Sales Representative",
        "Role":"Inside Sales Representative",
        "Job Description":"Inside Sales Representatives are responsible for selling products or services to customers over the phone or through online channels. They engage with leads, answer customer inquiries, and use persuasive communication to close sales and meet revenue targets.",
        "skills":"Sales prospecting and lead generation Sales presentation and communication CRM software (e.g., Salesforce) Sales negotiation and closing techniques Product knowledge Relationship building",
        "Responsibilities":"Identify and qualify sales leads, conduct sales presentations, and close deals through phone and email. Maintain accurate sales records and reports. Provide excellent customer service throughout the sales process.",
        "Summary":"\n  Job Tile: Sales Representative\n  Job Description: Inside Sales Representatives are responsible for selling products or services to customers over the phone or through online channels. They engage with leads, answer customer inquiries, and use persuasive communication to close sales and meet revenue targets.\n  Qualification: PhD\n  Experience: 4 to 8 Years\n  Skills: Sales prospecting and lead generation Sales presentation and communication CRM software (e.g., Salesforce) Sales negotiation and closing techniques Product knowledge Relationship building\n  Responsibilities: Identify and qualify sales leads, conduct sales presentations, and close deals through phone and email. Maintain accurate sales records and reports. Provide excellent customer service throughout the sales process.\n  "
    },
    {
        "Experience":"1 to 11 Years",
        "Qualifications":"BBA",
        "Salary Range":"$63K-$104K",
        "Job Title":"Environmental Consultant",
        "Role":"Sustainability Consultant",
        "Job Description":"Sustainability Consultants advise organizations on sustainable practices and strategies. They assess environmental impact, recommend sustainability initiatives, and assist in the development and implementation of sustainable policies.",
        "skills":"Sustainability consulting Sustainability assessments Sustainable practices Green building standards Environmental policies Client communication",
        "Responsibilities":"Focus on sustainable practices and initiatives, advising clients on reducing their environmental footprint. Develop sustainability plans and strategies. Conduct sustainability audits and reporting.",
        "Summary":"\n  Job Tile: Environmental Consultant\n  Job Description: Sustainability Consultants advise organizations on sustainable practices and strategies. They assess environmental impact, recommend sustainability initiatives, and assist in the development and implementation of sustainable policies.\n  Qualification: BBA\n  Experience: 1 to 11 Years\n  Skills: Sustainability consulting Sustainability assessments Sustainable practices Green building standards Environmental policies Client communication\n  Responsibilities: Focus on sustainable practices and initiatives, advising clients on reducing their environmental footprint. Develop sustainability plans and strategies. Conduct sustainability audits and reporting.\n  "
    },
    {
        "Experience":"5 to 13 Years",
        "Qualifications":"BBA",
        "Salary Range":"$59K-$113K",
        "Job Title":"Electrical Engineer",
        "Role":"Electronics Hardware Engineer",
        "Job Description":"Electronics Hardware Engineers develop and design electronic components and systems, from circuit boards to hardware prototypes, ensuring functionality and performance.",
        "skills":"Electronics design PCB layout Embedded systems Circuit analysis Troubleshooting",
        "Responsibilities":"Develop electronic hardware components and circuits for various applications. Conduct testing and validation of electronic systems. Collaborate with cross-functional teams on product development.",
        "Summary":"\n  Job Tile: Electrical Engineer\n  Job Description: Electronics Hardware Engineers develop and design electronic components and systems, from circuit boards to hardware prototypes, ensuring functionality and performance.\n  Qualification: BBA\n  Experience: 5 to 13 Years\n  Skills: Electronics design PCB layout Embedded systems Circuit analysis Troubleshooting\n  Responsibilities: Develop electronic hardware components and circuits for various applications. Conduct testing and validation of electronic systems. Collaborate with cross-functional teams on product development.\n  "
    },
    {
        "Experience":"0 to 9 Years",
        "Qualifications":"M.Tech",
        "Salary Range":"$65K-$107K",
        "Job Title":"Systems Engineer",
        "Role":"Systems Integration Specialist",
        "Job Description":"The role of a Systems Integration Specialist involves integrating various software and hardware components to create cohesive systems. You will design and implement solutions that enable different systems to communicate and work together seamlessly. Your responsibilities also include troubleshooting integration issues, ensuring data consistency, and collaborating with cross-functional teams.",
        "skills":"Systems integration Integration architecture Data mapping Middleware technologies API integration System testing Troubleshooting",
        "Responsibilities":"Integrate various software and hardware systems within an organization, ensuring seamless data flow and interoperability. Collaborate with software developers and IT teams on integration projects.",
        "Summary":"\n  Job Tile: Systems Engineer\n  Job Description: The role of a Systems Integration Specialist involves integrating various software and hardware components to create cohesive systems. You will design and implement solutions that enable different systems to communicate and work together seamlessly. Your responsibilities also include troubleshooting integration issues, ensuring data consistency, and collaborating with cross-functional teams.\n  Qualification: M.Tech\n  Experience: 0 to 9 Years\n  Skills: Systems integration Integration architecture Data mapping Middleware technologies API integration System testing Troubleshooting\n  Responsibilities: Integrate various software and hardware systems within an organization, ensuring seamless data flow and interoperability. Collaborate with software developers and IT teams on integration projects.\n  "
    },
    {
        "Experience":"2 to 12 Years",
        "Qualifications":"B.Tech",
        "Salary Range":"$64K-$103K",
        "Job Title":"Art Teacher",
        "Role":"Art Education Coordinator",
        "Job Description":"An Art Education Coordinator plans and manages art education programs, curriculum development, and educational outreach to promote art appreciation and learning within communities.",
        "skills":"Art education curriculum Program development Teacher training Communication skills Artistic expertise",
        "Responsibilities":"Coordinate art education programs, curriculum development, and student assessments. Collaborate with other educators and schools. Organize art exhibitions and showcases.",
        "Summary":"\n  Job Tile: Art Teacher\n  Job Description: An Art Education Coordinator plans and manages art education programs, curriculum development, and educational outreach to promote art appreciation and learning within communities.\n  Qualification: B.Tech\n  Experience: 2 to 12 Years\n  Skills: Art education curriculum Program development Teacher training Communication skills Artistic expertise\n  Responsibilities: Coordinate art education programs, curriculum development, and student assessments. Collaborate with other educators and schools. Organize art exhibitions and showcases.\n  "
    },
    {
        "Experience":"1 to 8 Years",
        "Qualifications":"MCA",
        "Salary Range":"$58K-$83K",
        "Job Title":"Human Resources Manager",
        "Role":"Talent Acquisition Manager",
        "Job Description":"Talent Acquisition Managers oversee the recruitment and hiring process. They develop recruitment strategies, source candidates, conduct interviews, and collaborate with hiring managers to attract and hire qualified talent to meet the organizations staffing needs.",
        "skills":"Talent sourcing Interviewing Onboarding Recruitment strategies HR software",
        "Responsibilities":"Lead talent acquisition efforts, including sourcing, interviewing, and onboarding new employees. Collaborate with hiring managers to define job requirements. Develop and implement recruitment strategies.",
        "Summary":"\n  Job Tile: Human Resources Manager\n  Job Description: Talent Acquisition Managers oversee the recruitment and hiring process. They develop recruitment strategies, source candidates, conduct interviews, and collaborate with hiring managers to attract and hire qualified talent to meet the organizations staffing needs.\n  Qualification: MCA\n  Experience: 1 to 8 Years\n  Skills: Talent sourcing Interviewing Onboarding Recruitment strategies HR software\n  Responsibilities: Lead talent acquisition efforts, including sourcing, interviewing, and onboarding new employees. Collaborate with hiring managers to define job requirements. Develop and implement recruitment strategies.\n  "
    },
    {
        "Experience":"1 to 15 Years",
        "Qualifications":"MCA",
        "Salary Range":"$55K-$126K",
        "Job Title":"Inventory Analyst",
        "Role":"Inventory Control Specialist",
        "Job Description":"Inventory Control Specialists manage and optimize inventory levels in a business. They track stock, monitor demand, and implement inventory control procedures to ensure efficient operations and minimize carrying costs.",
        "skills":"Inventory management Stock control Demand forecasting Inventory tracking systems Supply chain coordination Problem-solving skills",
        "Responsibilities":"Manage inventory levels, track stock movements, and optimize inventory turnover. Conduct regular inventory counts and reconcile discrepancies. Ensure accurate and efficient inventory management.",
        "Summary":"\n  Job Tile: Inventory Analyst\n  Job Description: Inventory Control Specialists manage and optimize inventory levels in a business. They track stock, monitor demand, and implement inventory control procedures to ensure efficient operations and minimize carrying costs.\n  Qualification: MCA\n  Experience: 1 to 15 Years\n  Skills: Inventory management Stock control Demand forecasting Inventory tracking systems Supply chain coordination Problem-solving skills\n  Responsibilities: Manage inventory levels, track stock movements, and optimize inventory turnover. Conduct regular inventory counts and reconcile discrepancies. Ensure accurate and efficient inventory management.\n  "
    },
    {
        "Experience":"4 to 13 Years",
        "Qualifications":"M.Com",
        "Salary Range":"$58K-$121K",
        "Job Title":"Legal Counsel",
        "Role":"Corporate Attorney",
        "Job Description":"Corporate Attorneys provide legal counsel and representation to organizations. They handle legal matters, contracts, mergers, acquisitions, and ensure compliance with laws and regulations relevant to the business.",
        "skills":"Corporate law and regulations Contract drafting and negotiation Legal research and analysis Risk management Excellent communication and negotiation skills",
        "Responsibilities":"Provide legal advice and guidance on corporate matters, contracts, and regulatory compliance. Draft and review legal documents and agreements. Represent the company in legal proceedings.",
        "Summary":"\n  Job Tile: Legal Counsel\n  Job Description: Corporate Attorneys provide legal counsel and representation to organizations. They handle legal matters, contracts, mergers, acquisitions, and ensure compliance with laws and regulations relevant to the business.\n  Qualification: M.Com\n  Experience: 4 to 13 Years\n  Skills: Corporate law and regulations Contract drafting and negotiation Legal research and analysis Risk management Excellent communication and negotiation skills\n  Responsibilities: Provide legal advice and guidance on corporate matters, contracts, and regulatory compliance. Draft and review legal documents and agreements. Represent the company in legal proceedings.\n  "
    },
    {
        "Experience":"4 to 14 Years",
        "Qualifications":"MCA",
        "Salary Range":"$58K-$81K",
        "Job Title":"Database Developer",
        "Role":"SQL Database Developer",
        "Job Description":"SQL Database Developers design, implement, and maintain relational databases using SQL (Structured Query Language). They write queries, optimize database performance, and ensure data integrity and security.",
        "skills":"SQL (Structured Query Language) Database design Query optimization Data modeling Database maintenance Problem-solving skills",
        "Responsibilities":"Design, develop, and maintain SQL databases, ensuring data integrity and performance. Write complex SQL queries and stored procedures. Troubleshoot database issues and optimize queries.",
        "Summary":"\n  Job Tile: Database Developer\n  Job Description: SQL Database Developers design, implement, and maintain relational databases using SQL (Structured Query Language). They write queries, optimize database performance, and ensure data integrity and security.\n  Qualification: MCA\n  Experience: 4 to 14 Years\n  Skills: SQL (Structured Query Language) Database design Query optimization Data modeling Database maintenance Problem-solving skills\n  Responsibilities: Design, develop, and maintain SQL databases, ensuring data integrity and performance. Write complex SQL queries and stored procedures. Troubleshoot database issues and optimize queries.\n  "
    },
    {
        "Experience":"1 to 9 Years",
        "Qualifications":"B.Tech",
        "Salary Range":"$59K-$108K",
        "Job Title":"Procurement Specialist",
        "Role":"Procurement Manager",
        "Job Description":"Procurement Managers oversee procurement processes, managing vendor relationships, negotiating contracts, and ensuring cost-effective purchasing of goods and services.",
        "skills":"Procurement strategies Supplier management Negotiation Cost analysis Supply chain management",
        "Responsibilities":"Manage procurement processes, vendor relationships, and supplier negotiations. Develop procurement strategies and cost-saving initiatives. Ensure timely delivery of goods and services.",
        "Summary":"\n  Job Tile: Procurement Specialist\n  Job Description: Procurement Managers oversee procurement processes, managing vendor relationships, negotiating contracts, and ensuring cost-effective purchasing of goods and services.\n  Qualification: B.Tech\n  Experience: 1 to 9 Years\n  Skills: Procurement strategies Supplier management Negotiation Cost analysis Supply chain management\n  Responsibilities: Manage procurement processes, vendor relationships, and supplier negotiations. Develop procurement strategies and cost-saving initiatives. Ensure timely delivery of goods and services.\n  "
    },
    {
        "Experience":"5 to 15 Years",
        "Qualifications":"B.Com",
        "Salary Range":"$63K-$85K",
        "Job Title":"Systems Analyst",
        "Role":"IT Analyst",
        "Job Description":"An IT Analyst assesses and analyzes IT systems, identifying areas for improvement, implementing technology solutions, and providing technical support to users and departments.",
        "skills":"IT systems analysis Troubleshooting IT support and documentation",
        "Responsibilities":"Analyze business systems, processes, and requirements to identify IT solutions. Develop system specifications and requirements documents. Collaborate with IT teams to implement solutions.",
        "Summary":"\n  Job Tile: Systems Analyst\n  Job Description: An IT Analyst assesses and analyzes IT systems, identifying areas for improvement, implementing technology solutions, and providing technical support to users and departments.\n  Qualification: B.Com\n  Experience: 5 to 15 Years\n  Skills: IT systems analysis Troubleshooting IT support and documentation\n  Responsibilities: Analyze business systems, processes, and requirements to identify IT solutions. Develop system specifications and requirements documents. Collaborate with IT teams to implement solutions.\n  "
    },
    {
        "Experience":"0 to 12 Years",
        "Qualifications":"MBA",
        "Salary Range":"$61K-$94K",
        "Job Title":"Copywriter",
        "Role":"Creative Copywriter",
        "Job Description":"Creative Copywriters craft engaging and persuasive copy for marketing materials, advertisements, and content marketing campaigns. They use their writing skills to captivate audiences and convey brand messages effectively.",
        "skills":"Creative writing Copywriting Advertising copy Content creation Brand storytelling Marketing campaigns Proofreading and editing",
        "Responsibilities":"Write creative and persuasive copy for advertising campaigns, marketing materials, and brand storytelling. Develop unique and engaging brand voices and messages. Collaborate with art directors and designers.",
        "Summary":"\n  Job Tile: Copywriter\n  Job Description: Creative Copywriters craft engaging and persuasive copy for marketing materials, advertisements, and content marketing campaigns. They use their writing skills to captivate audiences and convey brand messages effectively.\n  Qualification: MBA\n  Experience: 0 to 12 Years\n  Skills: Creative writing Copywriting Advertising copy Content creation Brand storytelling Marketing campaigns Proofreading and editing\n  Responsibilities: Write creative and persuasive copy for advertising campaigns, marketing materials, and brand storytelling. Develop unique and engaging brand voices and messages. Collaborate with art directors and designers.\n  "
    },
    {
        "Experience":"4 to 15 Years",
        "Qualifications":"BCA",
        "Salary Range":"$61K-$122K",
        "Job Title":"Content Writer",
        "Role":"Content Strategist",
        "Job Description":"Content Strategists develop and execute content strategies that align with business objectives. They plan content creation, distribution, and promotion to engage audiences and drive brand growth.",
        "skills":"Content strategy Content planning SEO optimization Content marketing Analytics",
        "Responsibilities":"Develop content strategies, plan editorial calendars, and ensure content aligns with marketing and branding objectives. Monitor content performance and adjust strategies. Identify content trends and opportunities.",
        "Summary":"\n  Job Tile: Content Writer\n  Job Description: Content Strategists develop and execute content strategies that align with business objectives. They plan content creation, distribution, and promotion to engage audiences and drive brand growth.\n  Qualification: BCA\n  Experience: 4 to 15 Years\n  Skills: Content strategy Content planning SEO optimization Content marketing Analytics\n  Responsibilities: Develop content strategies, plan editorial calendars, and ensure content aligns with marketing and branding objectives. Monitor content performance and adjust strategies. Identify content trends and opportunities.\n  "
    },
    {
        "Experience":"2 to 14 Years",
        "Qualifications":"MBA",
        "Salary Range":"$65K-$107K",
        "Job Title":"HR Coordinator",
        "Role":"Training Coordinator",
        "Job Description":"Training Coordinators design and implement employee training programs. They assess training needs, develop training materials, and facilitate training sessions to enhance employees skills and knowledge.",
        "skills":"Training program coordination Training material development Learning management systems",
        "Responsibilities":"Coordinate employee training programs, track training records, and assist with training logistics. Identify training needs and develop training materials. Facilitate training sessions or workshops.",
        "Summary":"\n  Job Tile: HR Coordinator\n  Job Description: Training Coordinators design and implement employee training programs. They assess training needs, develop training materials, and facilitate training sessions to enhance employees skills and knowledge.\n  Qualification: MBA\n  Experience: 2 to 14 Years\n  Skills: Training program coordination Training material development Learning management systems\n  Responsibilities: Coordinate employee training programs, track training records, and assist with training logistics. Identify training needs and develop training materials. Facilitate training sessions or workshops.\n  "
    },
    {
        "Experience":"3 to 13 Years",
        "Qualifications":"BCA",
        "Salary Range":"$65K-$113K",
        "Job Title":"Business Development Manager",
        "Role":"Strategic Partnerships Manager",
        "Job Description":"A Strategic Partnerships Manager identifies and develops strategic partnerships and alliances that benefit the organization, fostering collaborations and driving mutual success.",
        "skills":"Partnership development Negotiation and collaboration Business development",
        "Responsibilities":"Identify and establish strategic partnerships and alliances. Negotiate partnership agreements and terms. Collaborate with partners to achieve mutual business goals.",
        "Summary":"\n  Job Tile: Business Development Manager\n  Job Description: A Strategic Partnerships Manager identifies and develops strategic partnerships and alliances that benefit the organization, fostering collaborations and driving mutual success.\n  Qualification: BCA\n  Experience: 3 to 13 Years\n  Skills: Partnership development Negotiation and collaboration Business development\n  Responsibilities: Identify and establish strategic partnerships and alliances. Negotiate partnership agreements and terms. Collaborate with partners to achieve mutual business goals.\n  "
    },
    {
        "Experience":"0 to 12 Years",
        "Qualifications":"B.Com",
        "Salary Range":"$63K-$96K",
        "Job Title":"Java Developer",
        "Role":"Java Backend Developer",
        "Job Description":"Java Backend Developers specialize in building the server-side components of software applications using Java. They work on database integration, server logic, and performance optimization to ensure efficient and reliable backend functionality.",
        "skills":"Backend development RESTful APIs Database integration Java EE (Enterprise Edition) Performance optimization Version control (e.g., Git)",
        "Responsibilities":"Develop server-side applications and APIs using Java and related technologies. Optimize application performance and scalability. Implement security measures and authentication systems.",
        "Summary":"\n  Job Tile: Java Developer\n  Job Description: Java Backend Developers specialize in building the server-side components of software applications using Java. They work on database integration, server logic, and performance optimization to ensure efficient and reliable backend functionality.\n  Qualification: B.Com\n  Experience: 0 to 12 Years\n  Skills: Backend development RESTful APIs Database integration Java EE (Enterprise Edition) Performance optimization Version control (e.g., Git)\n  Responsibilities: Develop server-side applications and APIs using Java and related technologies. Optimize application performance and scalability. Implement security measures and authentication systems.\n  "
    },
    {
        "Experience":"5 to 10 Years",
        "Qualifications":"BA",
        "Salary Range":"$56K-$129K",
        "Job Title":"Supply Chain Manager",
        "Role":"Demand Planner",
        "Job Description":"A Demand Planner analyzes historical sales data to forecast future demand for products. They work to optimize inventory levels and ensure product availability while minimizing costs.",
        "skills":"Demand forecasting Inventory management Data analysis Sales and operations planning (S&OP) ERP software proficiency",
        "Responsibilities":"Analyze demand patterns and market trends to forecast product demand. Collaborate with production and sales teams to optimize inventory levels. Implement demand planning and forecasting tools.",
        "Summary":"\n  Job Tile: Supply Chain Manager\n  Job Description: A Demand Planner analyzes historical sales data to forecast future demand for products. They work to optimize inventory levels and ensure product availability while minimizing costs.\n  Qualification: BA\n  Experience: 5 to 10 Years\n  Skills: Demand forecasting Inventory management Data analysis Sales and operations planning (S&OP) ERP software proficiency\n  Responsibilities: Analyze demand patterns and market trends to forecast product demand. Collaborate with production and sales teams to optimize inventory levels. Implement demand planning and forecasting tools.\n  "
    },
    {
        "Experience":"0 to 13 Years",
        "Qualifications":"PhD",
        "Salary Range":"$60K-$100K",
        "Job Title":"Event Coordinator",
        "Role":"Event Planner",
        "Job Description":"Plan and coordinate events, including selecting venues, managing budgets, arranging logistics, and ensuring a successful outcome.",
        "skills":"Event planning and coordination Budget management Vendor negotiation Venue selection and management Timeline and logistics planning Marketing and promotion Risk management Client communication Creativity Problem-solving Attention to detail",
        "Responsibilities":"Plan and organize events, such as weddings, conferences, and parties. Coordinate logistics, vendors, and budgets. Ensure events run smoothly and meet client expectations.",
        "Summary":"\n  Job Tile: Event Coordinator\n  Job Description: Plan and coordinate events, including selecting venues, managing budgets, arranging logistics, and ensuring a successful outcome.\n  Qualification: PhD\n  Experience: 0 to 13 Years\n  Skills: Event planning and coordination Budget management Vendor negotiation Venue selection and management Timeline and logistics planning Marketing and promotion Risk management Client communication Creativity Problem-solving Attention to detail\n  Responsibilities: Plan and organize events, such as weddings, conferences, and parties. Coordinate logistics, vendors, and budgets. Ensure events run smoothly and meet client expectations.\n  "
    },
    {
        "Experience":"0 to 10 Years",
        "Qualifications":"BA",
        "Salary Range":"$62K-$102K",
        "Job Title":"Family Nurse Practitioner",
        "Role":"Geriatric Nurse Practitioner",
        "Job Description":"Geriatric Nurse Practitioners focus on the healthcare needs of elderly patients. They provide specialized care and address age-related health concerns.",
        "skills":"Geriatric healthcare Geriatric assessment Geriatric treatment Elderly patient care Geriatric pharmacology",
        "Responsibilities":"Focus on elderly patient care, addressing age-related health concerns. Manage chronic conditions and medication regimens. Collaborate with healthcare teams in nursing homes or geriatric clinics.",
        "Summary":"\n  Job Tile: Family Nurse Practitioner\n  Job Description: Geriatric Nurse Practitioners focus on the healthcare needs of elderly patients. They provide specialized care and address age-related health concerns.\n  Qualification: BA\n  Experience: 0 to 10 Years\n  Skills: Geriatric healthcare Geriatric assessment Geriatric treatment Elderly patient care Geriatric pharmacology\n  Responsibilities: Focus on elderly patient care, addressing age-related health concerns. Manage chronic conditions and medication regimens. Collaborate with healthcare teams in nursing homes or geriatric clinics.\n  "
    },
    {
        "Experience":"2 to 10 Years",
        "Qualifications":"M.Tech",
        "Salary Range":"$58K-$125K",
        "Job Title":"Front-End Engineer",
        "Role":"JavaScript Developer",
        "Job Description":"JavaScript Developers write code to create interactive and dynamic web applications. They use JavaScript libraries and frameworks to build client-side functionality, ensuring smooth user interactions and responsive web design.",
        "skills":"JavaScript programming Frontend development Frontend frameworks (e.g., React, Angular) DOM manipulation AJAX Debugging and troubleshooting",
        "Responsibilities":"Develop interactive web applications using JavaScript frameworks and libraries, such as React or Angular. Debug and resolve frontend issues. Ensure cross-browser compatibility.",
        "Summary":"\n  Job Tile: Front-End Engineer\n  Job Description: JavaScript Developers write code to create interactive and dynamic web applications. They use JavaScript libraries and frameworks to build client-side functionality, ensuring smooth user interactions and responsive web design.\n  Qualification: M.Tech\n  Experience: 2 to 10 Years\n  Skills: JavaScript programming Frontend development Frontend frameworks (e.g., React, Angular) DOM manipulation AJAX Debugging and troubleshooting\n  Responsibilities: Develop interactive web applications using JavaScript frameworks and libraries, such as React or Angular. Debug and resolve frontend issues. Ensure cross-browser compatibility.\n  "
    },
    {
        "Experience":"4 to 12 Years",
        "Qualifications":"BCA",
        "Salary Range":"$55K-$111K",
        "Job Title":"Customer Success Manager",
        "Role":"Account Manager",
        "Job Description":"An Account Manager builds and maintains relationships with clients or customers, ensuring their needs are met and promoting products or services to drive revenue and growth.",
        "skills":"Account management Customer relationship management Sales and negotiation Business development Client needs analysis",
        "Responsibilities":"Build and nurture relationships with key clients, understanding their business goals. Identify opportunities for upselling or cross-selling products or services. Ensure client satisfaction and retention.",
        "Summary":"\n  Job Tile: Customer Success Manager\n  Job Description: An Account Manager builds and maintains relationships with clients or customers, ensuring their needs are met and promoting products or services to drive revenue and growth.\n  Qualification: BCA\n  Experience: 4 to 12 Years\n  Skills: Account management Customer relationship management Sales and negotiation Business development Client needs analysis\n  Responsibilities: Build and nurture relationships with key clients, understanding their business goals. Identify opportunities for upselling or cross-selling products or services. Ensure client satisfaction and retention.\n  "
    },
    {
        "Experience":"0 to 12 Years",
        "Qualifications":"BCA",
        "Salary Range":"$59K-$113K",
        "Job Title":"Procurement Coordinator",
        "Role":"Purchasing Coordinator",
        "Job Description":"Purchasing Coordinators manage procurement processes. They source and purchase goods and services, negotiate with suppliers, and ensure cost-effective and timely acquisitions.",
        "skills":"Procurement Supplier management Negotiation Supply chain management Inventory control Vendor relations",
        "Responsibilities":"Coordinate purchasing activities, including vendor sourcing and negotiation. Create purchase orders and track deliveries. Ensure cost-effective procurement.",
        "Summary":"\n  Job Tile: Procurement Coordinator\n  Job Description: Purchasing Coordinators manage procurement processes. They source and purchase goods and services, negotiate with suppliers, and ensure cost-effective and timely acquisitions.\n  Qualification: BCA\n  Experience: 0 to 12 Years\n  Skills: Procurement Supplier management Negotiation Supply chain management Inventory control Vendor relations\n  Responsibilities: Coordinate purchasing activities, including vendor sourcing and negotiation. Create purchase orders and track deliveries. Ensure cost-effective procurement.\n  "
    },
    {
        "Experience":"5 to 10 Years",
        "Qualifications":"BBA",
        "Salary Range":"$57K-$104K",
        "Job Title":"Urban Planner",
        "Role":"Transportation Planner",
        "Job Description":"Transportation Planners design and manage transportation systems. They optimize traffic flow, plan public transit routes, and enhance overall transportation efficiency.",
        "skills":"Transportation planning Traffic engineering GIS proficiency Public transportation Project management",
        "Responsibilities":"Specialize in transportation infrastructure and traffic management. Design efficient transportation networks. Address traffic congestion and improve public transit systems.",
        "Summary":"\n  Job Tile: Urban Planner\n  Job Description: Transportation Planners design and manage transportation systems. They optimize traffic flow, plan public transit routes, and enhance overall transportation efficiency.\n  Qualification: BBA\n  Experience: 5 to 10 Years\n  Skills: Transportation planning Traffic engineering GIS proficiency Public transportation Project management\n  Responsibilities: Specialize in transportation infrastructure and traffic management. Design efficient transportation networks. Address traffic congestion and improve public transit systems.\n  "
    },
    {
        "Experience":"3 to 15 Years",
        "Qualifications":"M.Com",
        "Salary Range":"$62K-$98K",
        "Job Title":"Architectural Designer",
        "Role":"Interior Designer",
        "Job Description":"Interior Designers plan and design interior spaces to meet the functional and aesthetic needs of clients. They select furniture, colors, materials, and layouts to create visually appealing and functional interiors for homes and businesses.",
        "skills":"Interior design Space planning Color theory Material selection CAD software (e.g., SketchUp) Client collaboration Budget management",
        "Responsibilities":"Focus on interior spaces, selecting finishes, furnishings, and color schemes. Create interior design concepts and mood boards. Collaborate with architects and contractors on design integration.",
        "Summary":"\n  Job Tile: Architectural Designer\n  Job Description: Interior Designers plan and design interior spaces to meet the functional and aesthetic needs of clients. They select furniture, colors, materials, and layouts to create visually appealing and functional interiors for homes and businesses.\n  Qualification: M.Com\n  Experience: 3 to 15 Years\n  Skills: Interior design Space planning Color theory Material selection CAD software (e.g., SketchUp) Client collaboration Budget management\n  Responsibilities: Focus on interior spaces, selecting finishes, furnishings, and color schemes. Create interior design concepts and mood boards. Collaborate with architects and contractors on design integration.\n  "
    },
    {
        "Experience":"4 to 14 Years",
        "Qualifications":"B.Tech",
        "Salary Range":"$56K-$92K",
        "Job Title":"Financial Analyst",
        "Role":"Investment Analyst",
        "Job Description":"Investment Analysts analyze financial data and market trends to make informed investment recommendations. They research and assess investment opportunities, create financial models, and provide insights to guide investment decisions and portfolio management.",
        "skills":"Financial analysis Investment evaluation Portfolio management Data analysis",
        "Responsibilities":"Analyze financial data, research investment opportunities, and provide recommendations for investment decisions. Monitor financial markets and economic trends. Prepare investment reports and presentations.",
        "Summary":"\n  Job Tile: Financial Analyst\n  Job Description: Investment Analysts analyze financial data and market trends to make informed investment recommendations. They research and assess investment opportunities, create financial models, and provide insights to guide investment decisions and portfolio management.\n  Qualification: B.Tech\n  Experience: 4 to 14 Years\n  Skills: Financial analysis Investment evaluation Portfolio management Data analysis\n  Responsibilities: Analyze financial data, research investment opportunities, and provide recommendations for investment decisions. Monitor financial markets and economic trends. Prepare investment reports and presentations.\n  "
    },
    {
        "Experience":"2 to 10 Years",
        "Qualifications":"M.Tech",
        "Salary Range":"$61K-$116K",
        "Job Title":"Environmental Engineer",
        "Role":"Sustainability Specialist",
        "Job Description":"A Sustainability Specialist promotes sustainability initiatives within organizations, develops sustainability programs, and helps reduce environmental impacts while increasing efficiency.",
        "skills":"Sustainability practices Environmental management systems Green certifications",
        "Responsibilities":"Promote sustainability practices within organizations. Develop sustainability plans and initiatives. Monitor and report on sustainability metrics and goals.",
        "Summary":"\n  Job Tile: Environmental Engineer\n  Job Description: A Sustainability Specialist promotes sustainability initiatives within organizations, develops sustainability programs, and helps reduce environmental impacts while increasing efficiency.\n  Qualification: M.Tech\n  Experience: 2 to 10 Years\n  Skills: Sustainability practices Environmental management systems Green certifications\n  Responsibilities: Promote sustainability practices within organizations. Develop sustainability plans and initiatives. Monitor and report on sustainability metrics and goals.\n  "
    },
    {
        "Experience":"1 to 15 Years",
        "Qualifications":"M.Com",
        "Salary Range":"$60K-$98K",
        "Job Title":"Back-End Developer",
        "Role":"Server Developer",
        "Job Description":"A Server Developer specializes in developing and maintaining server-side applications and systems, ensuring efficient data processing and server functionality.",
        "skills":"Server-side programming languages (e.g., Java, Python) Database management API development",
        "Responsibilities":"Develop and maintain server-side logic and databases for web applications. Optimize server performance and scalability. Collaborate with front-end developers to integrate user interfaces.",
        "Summary":"\n  Job Tile: Back-End Developer\n  Job Description: A Server Developer specializes in developing and maintaining server-side applications and systems, ensuring efficient data processing and server functionality.\n  Qualification: M.Com\n  Experience: 1 to 15 Years\n  Skills: Server-side programming languages (e.g., Java, Python) Database management API development\n  Responsibilities: Develop and maintain server-side logic and databases for web applications. Optimize server performance and scalability. Collaborate with front-end developers to integrate user interfaces.\n  "
    },
    {
        "Experience":"3 to 12 Years",
        "Qualifications":"BBA",
        "Salary Range":"$60K-$108K",
        "Job Title":"Structural Engineer",
        "Role":"Design Engineer",
        "Job Description":"A Design Engineer creates and develops product designs and specifications, using engineering principles and design software to bring innovative products to market.",
        "skills":"Engineering design CAD software proficiency Problem-solving Technical knowledge Communication skills",
        "Responsibilities":"Design structural systems and components for buildings and infrastructure projects. Perform structural analysis and calculations. Create detailed design plans and specifications.",
        "Summary":"\n  Job Tile: Structural Engineer\n  Job Description: A Design Engineer creates and develops product designs and specifications, using engineering principles and design software to bring innovative products to market.\n  Qualification: BBA\n  Experience: 3 to 12 Years\n  Skills: Engineering design CAD software proficiency Problem-solving Technical knowledge Communication skills\n  Responsibilities: Design structural systems and components for buildings and infrastructure projects. Perform structural analysis and calculations. Create detailed design plans and specifications.\n  "
    },
    {
        "Experience":"2 to 10 Years",
        "Qualifications":"M.Com",
        "Salary Range":"$63K-$106K",
        "Job Title":"Market Research Analyst",
        "Role":"Market Research Coordinator",
        "Job Description":"A Market Research Coordinator supports market research initiatives by organizing and managing research projects, data collection, and analysis efforts.",
        "skills":"Market research coordination Survey design and administration Data analysis",
        "Responsibilities":"Coordinate research projects, including participant recruitment and data collection. Collaborate with research teams and ensure project timelines are met. Maintain research databases and records.",
        "Summary":"\n  Job Tile: Market Research Analyst\n  Job Description: A Market Research Coordinator supports market research initiatives by organizing and managing research projects, data collection, and analysis efforts.\n  Qualification: M.Com\n  Experience: 2 to 10 Years\n  Skills: Market research coordination Survey design and administration Data analysis\n  Responsibilities: Coordinate research projects, including participant recruitment and data collection. Collaborate with research teams and ensure project timelines are met. Maintain research databases and records.\n  "
    },
    {
        "Experience":"0 to 14 Years",
        "Qualifications":"BBA",
        "Salary Range":"$55K-$95K",
        "Job Title":"Customer Service Representative",
        "Role":"Call Center Agent",
        "Job Description":"A Call Center Agent handles incoming and outgoing customer calls, providing assistance, resolving issues, and ensuring a positive customer experience over the phone.",
        "skills":"Customer service Call center operations Problem-solving skills",
        "Responsibilities":"Handle incoming phone calls and provide information or assistance. Follow call scripts and procedures. Document and report call details.",
        "Summary":"\n  Job Tile: Customer Service Representative\n  Job Description: A Call Center Agent handles incoming and outgoing customer calls, providing assistance, resolving issues, and ensuring a positive customer experience over the phone.\n  Qualification: BBA\n  Experience: 0 to 14 Years\n  Skills: Customer service Call center operations Problem-solving skills\n  Responsibilities: Handle incoming phone calls and provide information or assistance. Follow call scripts and procedures. Document and report call details.\n  "
    },
    {
        "Experience":"5 to 15 Years",
        "Qualifications":"BA",
        "Salary Range":"$56K-$87K",
        "Job Title":"Customer Support Specialist",
        "Role":"Customer Success Manager",
        "Job Description":"Customer Success Managers focus on ensuring customer satisfaction and retention. They build relationships with clients, understand their needs, and work to maximize the value customers receive from products or services, ultimately driving customer success and loyalty.",
        "skills":"Customer relationship management Onboarding and training Customer feedback analysis Retention strategies Cross-selling and upselling Strong communication and empathy Customer advocacy",
        "Responsibilities":"Build and maintain strong customer relationships, ensuring customer satisfaction and retention. Identify opportunities to upsell or cross-sell products or services. Gather and relay customer feedback to improve products.",
        "Summary":"\n  Job Tile: Customer Support Specialist\n  Job Description: Customer Success Managers focus on ensuring customer satisfaction and retention. They build relationships with clients, understand their needs, and work to maximize the value customers receive from products or services, ultimately driving customer success and loyalty.\n  Qualification: BA\n  Experience: 5 to 15 Years\n  Skills: Customer relationship management Onboarding and training Customer feedback analysis Retention strategies Cross-selling and upselling Strong communication and empathy Customer advocacy\n  Responsibilities: Build and maintain strong customer relationships, ensuring customer satisfaction and retention. Identify opportunities to upsell or cross-sell products or services. Gather and relay customer feedback to improve products.\n  "
    },
    {
        "Experience":"1 to 8 Years",
        "Qualifications":"B.Com",
        "Salary Range":"$63K-$127K",
        "Job Title":"Business Analyst",
        "Role":"IT Business Analyst",
        "Job Description":"IT Business Analysts bridge the gap between business needs and technology solutions. They analyze business processes, gather requirements, and create solutions that align with organizational goals.",
        "skills":"Business process analysis Requirement gathering Data analysis Communication skills",
        "Responsibilities":"Analyze business processes, gather requirements, and recommend solutions to enhance efficiency and productivity. Create business process models and documentation. Collaborate with IT teams to implement solutions.",
        "Summary":"\n  Job Tile: Business Analyst\n  Job Description: IT Business Analysts bridge the gap between business needs and technology solutions. They analyze business processes, gather requirements, and create solutions that align with organizational goals.\n  Qualification: B.Com\n  Experience: 1 to 8 Years\n  Skills: Business process analysis Requirement gathering Data analysis Communication skills\n  Responsibilities: Analyze business processes, gather requirements, and recommend solutions to enhance efficiency and productivity. Create business process models and documentation. Collaborate with IT teams to implement solutions.\n  "
    },
    {
        "Experience":"4 to 8 Years",
        "Qualifications":"B.Tech",
        "Salary Range":"$56K-$126K",
        "Job Title":"Social Media Manager",
        "Role":"Social Media Analyst",
        "Job Description":"Social Media Analysts analyze social media data and metrics to provide insights and recommendations for improving social media strategies. They track performance, identify trends, and support data-driven decision-making.",
        "skills":"Social media analytics tools (e.g., Google Analytics, Facebook Insights) Data analysis and reporting Social media ROI measurement Competitive analysis Trend identification",
        "Responsibilities":"Analyze social media data and user behavior to generate actionable insights. Track key performance indicators (KPIs) and recommend optimization strategies. Stay updated on social media trends and algorithm changes.",
        "Summary":"\n  Job Tile: Social Media Manager\n  Job Description: Social Media Analysts analyze social media data and metrics to provide insights and recommendations for improving social media strategies. They track performance, identify trends, and support data-driven decision-making.\n  Qualification: B.Tech\n  Experience: 4 to 8 Years\n  Skills: Social media analytics tools (e.g., Google Analytics, Facebook Insights) Data analysis and reporting Social media ROI measurement Competitive analysis Trend identification\n  Responsibilities: Analyze social media data and user behavior to generate actionable insights. Track key performance indicators (KPIs) and recommend optimization strategies. Stay updated on social media trends and algorithm changes.\n  "
    },
    {
        "Experience":"2 to 10 Years",
        "Qualifications":"PhD",
        "Salary Range":"$65K-$89K",
        "Job Title":"Family Lawyer",
        "Role":"Child Custody Lawyer",
        "Job Description":"Child Custody Lawyers specialize in family law, focusing on cases related to child custody and visitation rights. They represent clients in court, provide legal counsel, and advocate for the best interests of children in custody disputes.",
        "skills":"Child custody law Family law Legal advocacy Negotiation Court representation Legal research Client counseling Case preparation",
        "Responsibilities":"Specialize in child custody cases, advocating for the best interests of children. Conduct investigations, gather evidence, and present cases in court. Negotiate parenting plans and visitation schedules.",
        "Summary":"\n  Job Tile: Family Lawyer\n  Job Description: Child Custody Lawyers specialize in family law, focusing on cases related to child custody and visitation rights. They represent clients in court, provide legal counsel, and advocate for the best interests of children in custody disputes.\n  Qualification: PhD\n  Experience: 2 to 10 Years\n  Skills: Child custody law Family law Legal advocacy Negotiation Court representation Legal research Client counseling Case preparation\n  Responsibilities: Specialize in child custody cases, advocating for the best interests of children. Conduct investigations, gather evidence, and present cases in court. Negotiate parenting plans and visitation schedules.\n  "
    },
    {
        "Experience":"0 to 15 Years",
        "Qualifications":"BA",
        "Salary Range":"$60K-$114K",
        "Job Title":"Chemical Analyst",
        "Role":"Quality Control Analyst",
        "Job Description":"In the role of a Quality Control Analyst, you will be responsible for inspecting and testing products to ensure they meet quality standards and specifications. You will use quality control tools and processes to identify defects, document findings, and recommend improvements. Your role is essential in maintaining product quality and customer satisfaction.",
        "skills":"Quality control Quality assurance QC testing methods Compliance standards Root cause analysis Documentation Statistical analysis",
        "Responsibilities":"Ensure the quality and consistency of chemical products and processes through testing and inspection. Identify non-conformities and deviations. Maintain quality control documentation.",
        "Summary":"\n  Job Tile: Chemical Analyst\n  Job Description: In the role of a Quality Control Analyst, you will be responsible for inspecting and testing products to ensure they meet quality standards and specifications. You will use quality control tools and processes to identify defects, document findings, and recommend improvements. Your role is essential in maintaining product quality and customer satisfaction.\n  Qualification: BA\n  Experience: 0 to 15 Years\n  Skills: Quality control Quality assurance QC testing methods Compliance standards Root cause analysis Documentation Statistical analysis\n  Responsibilities: Ensure the quality and consistency of chemical products and processes through testing and inspection. Identify non-conformities and deviations. Maintain quality control documentation.\n  "
    },
    {
        "Experience":"0 to 13 Years",
        "Qualifications":"BCA",
        "Salary Range":"$63K-$85K",
        "Job Title":"Network Technician",
        "Role":"Network Security Specialist",
        "Job Description":"Network Security Specialists focus on network security. They implement security measures, monitor for threats, and respond to security incidents to protect network integrity.",
        "skills":"Network security Cybersecurity Intrusion detection Security analysis Firewall management",
        "Responsibilities":"Focus on network security, implementing measures to protect against cyber threats. Monitor network traffic for anomalies and security breaches. Conduct security audits and recommend improvements.",
        "Summary":"\n  Job Tile: Network Technician\n  Job Description: Network Security Specialists focus on network security. They implement security measures, monitor for threats, and respond to security incidents to protect network integrity.\n  Qualification: BCA\n  Experience: 0 to 13 Years\n  Skills: Network security Cybersecurity Intrusion detection Security analysis Firewall management\n  Responsibilities: Focus on network security, implementing measures to protect against cyber threats. Monitor network traffic for anomalies and security breaches. Conduct security audits and recommend improvements.\n  "
    },
    {
        "Experience":"2 to 12 Years",
        "Qualifications":"MBA",
        "Salary Range":"$59K-$109K",
        "Job Title":"Interior Designer",
        "Role":"Commercial Interior Designer",
        "Job Description":"A Commercial Interior Designer focuses on designing interior spaces for businesses and commercial properties. They optimize layouts for productivity and aesthetics.",
        "skills":"Commercial interior design Workplace ergonomics Building codes and regulations knowledge Sustainable design principles AutoCAD and Revit proficiency",
        "Responsibilities":"Design and optimize interior spaces for commercial and public use, such as offices, restaurants, and retail stores. Collaborate with architects and contractors. Ensure compliance with building codes and regulations.",
        "Summary":"\n  Job Tile: Interior Designer\n  Job Description: A Commercial Interior Designer focuses on designing interior spaces for businesses and commercial properties. They optimize layouts for productivity and aesthetics.\n  Qualification: MBA\n  Experience: 2 to 12 Years\n  Skills: Commercial interior design Workplace ergonomics Building codes and regulations knowledge Sustainable design principles AutoCAD and Revit proficiency\n  Responsibilities: Design and optimize interior spaces for commercial and public use, such as offices, restaurants, and retail stores. Collaborate with architects and contractors. Ensure compliance with building codes and regulations.\n  "
    },
    {
        "Experience":"2 to 10 Years",
        "Qualifications":"MCA",
        "Salary Range":"$59K-$120K",
        "Job Title":"Software Architect",
        "Role":"Cloud Architect",
        "Job Description":"A Cloud Architect designs and manages cloud-based solutions, optimizing scalability, security, and performance while aligning them with the companys technology strategy.",
        "skills":"Cloud computing platforms (AWS, Azure, etc.) Cloud security Containerization (Docker, Kubernetes)",
        "Responsibilities":"Design and implement cloud-based solutions, optimizing for performance and cost-efficiency. Develop cloud migration strategies. Architect and manage cloud infrastructure.",
        "Summary":"\n  Job Tile: Software Architect\n  Job Description: A Cloud Architect designs and manages cloud-based solutions, optimizing scalability, security, and performance while aligning them with the companys technology strategy.\n  Qualification: MCA\n  Experience: 2 to 10 Years\n  Skills: Cloud computing platforms (AWS, Azure, etc.) Cloud security Containerization (Docker, Kubernetes)\n  Responsibilities: Design and implement cloud-based solutions, optimizing for performance and cost-efficiency. Develop cloud migration strategies. Architect and manage cloud infrastructure.\n  "
    },
    {
        "Experience":"1 to 8 Years",
        "Qualifications":"B.Com",
        "Salary Range":"$60K-$125K",
        "Job Title":"Nurse Manager",
        "Role":"Nursing Director",
        "Job Description":"Nursing Directors oversee nursing departments in healthcare facilities. They manage nursing staff, develop policies and procedures, and ensure the delivery of high-quality patient care while adhering to regulatory standards.",
        "skills":"Nursing management Patient care coordination Staff supervision Compliance with healthcare regulations Quality improvement Leadership skills",
        "Responsibilities":"Oversee nursing staff and operations in healthcare settings. Develop nursing policies and procedures. Ensure compliance with healthcare regulations.",
        "Summary":"\n  Job Tile: Nurse Manager\n  Job Description: Nursing Directors oversee nursing departments in healthcare facilities. They manage nursing staff, develop policies and procedures, and ensure the delivery of high-quality patient care while adhering to regulatory standards.\n  Qualification: B.Com\n  Experience: 1 to 8 Years\n  Skills: Nursing management Patient care coordination Staff supervision Compliance with healthcare regulations Quality improvement Leadership skills\n  Responsibilities: Oversee nursing staff and operations in healthcare settings. Develop nursing policies and procedures. Ensure compliance with healthcare regulations.\n  "
    },
    {
        "Experience":"1 to 15 Years",
        "Qualifications":"BA",
        "Salary Range":"$65K-$107K",
        "Job Title":"Veterinarian",
        "Role":"Small Animal Veterinarian",
        "Job Description":"A Small Animal Veterinarian provides medical care to small pets, such as dogs and cats. They diagnose illnesses, perform surgeries, and advise pet owners on healthcare practices.",
        "skills":"Veterinary medicine Small animal care and surgery Animal diagnostics Preventive medicine Client communication Surgical skills Radiology Anesthesia Laboratory diagnostics Compassion and empathy Problem-solving Attention to detail",
        "Responsibilities":"Diagnose and treat illnesses and injuries in domestic pets, such as dogs and cats. Perform surgeries, vaccinations, and routine check-ups. Provide pet owners with medical advice and care plans.",
        "Summary":"\n  Job Tile: Veterinarian\n  Job Description: A Small Animal Veterinarian provides medical care to small pets, such as dogs and cats. They diagnose illnesses, perform surgeries, and advise pet owners on healthcare practices.\n  Qualification: BA\n  Experience: 1 to 15 Years\n  Skills: Veterinary medicine Small animal care and surgery Animal diagnostics Preventive medicine Client communication Surgical skills Radiology Anesthesia Laboratory diagnostics Compassion and empathy Problem-solving Attention to detail\n  Responsibilities: Diagnose and treat illnesses and injuries in domestic pets, such as dogs and cats. Perform surgeries, vaccinations, and routine check-ups. Provide pet owners with medical advice and care plans.\n  "
    },
    {
        "Experience":"4 to 8 Years",
        "Qualifications":"B.Com",
        "Salary Range":"$62K-$126K",
        "Job Title":"Process Engineer",
        "Role":"Chemical Engineer",
        "Job Description":"Chemical Engineers design and oversee processes for the production of chemicals and related products. They conduct experiments, analyze data, and develop processes to optimize production, ensure safety, and minimize environmental impact.",
        "skills":"Chemical engineering Process design Chemical reactions Safety protocols Laboratory techniques Problem-solving skills",
        "Responsibilities":"Specialize in chemical processes, including design and optimization. Monitor chemical reactions and processes. Ensure compliance with environmental regulations.",
        "Summary":"\n  Job Tile: Process Engineer\n  Job Description: Chemical Engineers design and oversee processes for the production of chemicals and related products. They conduct experiments, analyze data, and develop processes to optimize production, ensure safety, and minimize environmental impact.\n  Qualification: B.Com\n  Experience: 4 to 8 Years\n  Skills: Chemical engineering Process design Chemical reactions Safety protocols Laboratory techniques Problem-solving skills\n  Responsibilities: Specialize in chemical processes, including design and optimization. Monitor chemical reactions and processes. Ensure compliance with environmental regulations.\n  "
    },
    {
        "Experience":"1 to 10 Years",
        "Qualifications":"MCA",
        "Salary Range":"$57K-$98K",
        "Job Title":"IT Manager",
        "Role":"Infrastructure Manager",
        "Job Description":"An Infrastructure Manager is responsible for the operation and maintenance of an organizations IT infrastructure, including servers, networks, and data centers.",
        "skills":"Network administration System administration Virtualization technologies (e.g., VMware, Hyper-V) Storage management IT security Disaster recovery planning Capacity planning Monitoring and troubleshooting Cloud infrastructure (e.g., AWS, Azure) Vendor management",
        "Responsibilities":"Manage IT infrastructure, including servers, networks, and data centers. Ensure high availability, security, and scalability of IT systems. Plan and implement technology upgrades.",
        "Summary":"\n  Job Tile: IT Manager\n  Job Description: An Infrastructure Manager is responsible for the operation and maintenance of an organizations IT infrastructure, including servers, networks, and data centers.\n  Qualification: MCA\n  Experience: 1 to 10 Years\n  Skills: Network administration System administration Virtualization technologies (e.g., VMware, Hyper-V) Storage management IT security Disaster recovery planning Capacity planning Monitoring and troubleshooting Cloud infrastructure (e.g., AWS, Azure) Vendor management\n  Responsibilities: Manage IT infrastructure, including servers, networks, and data centers. Ensure high availability, security, and scalability of IT systems. Plan and implement technology upgrades.\n  "
    },
    {
        "Experience":"3 to 12 Years",
        "Qualifications":"BA",
        "Salary Range":"$56K-$117K",
        "Job Title":"Quality Assurance Analyst",
        "Role":"QA Tester",
        "Job Description":"QA Testers assess software and applications for defects and quality issues. They conduct testing procedures, report bugs, and work with development teams to ensure the delivery of high-quality software products.",
        "skills":"Test planning and strategy Test case design and execution Defect reporting and tracking Test automation tools (e.g., Selenium, Appium) Regression testing",
        "Responsibilities":"Develop and execute test plans and test cases to identify software defects and issues. Document and report bugs, errors, and anomalies. Collaborate with development teams to resolve issues.",
        "Summary":"\n  Job Tile: Quality Assurance Analyst\n  Job Description: QA Testers assess software and applications for defects and quality issues. They conduct testing procedures, report bugs, and work with development teams to ensure the delivery of high-quality software products.\n  Qualification: BA\n  Experience: 3 to 12 Years\n  Skills: Test planning and strategy Test case design and execution Defect reporting and tracking Test automation tools (e.g., Selenium, Appium) Regression testing\n  Responsibilities: Develop and execute test plans and test cases to identify software defects and issues. Document and report bugs, errors, and anomalies. Collaborate with development teams to resolve issues.\n  "
    },
    {
        "Experience":"1 to 9 Years",
        "Qualifications":"MBA",
        "Salary Range":"$55K-$100K",
        "Job Title":"Pharmaceutical Sales Representative",
        "Role":"Medical Sales Specialist",
        "Job Description":"Medical Sales Specialists focus on selling medical devices, pharmaceuticals, or healthcare products to healthcare professionals and institutions.",
        "skills":"Medical product knowledge Understanding of healthcare regulations Relationship building with healthcare professionals Sales forecasting and planning Medical sales techniques",
        "Responsibilities":"Focus on medical equipment or devices sales to healthcare facilities and providers. Conduct product demonstrations and training. Understand and comply with industry regulations.",
        "Summary":"\n  Job Tile: Pharmaceutical Sales Representative\n  Job Description: Medical Sales Specialists focus on selling medical devices, pharmaceuticals, or healthcare products to healthcare professionals and institutions.\n  Qualification: MBA\n  Experience: 1 to 9 Years\n  Skills: Medical product knowledge Understanding of healthcare regulations Relationship building with healthcare professionals Sales forecasting and planning Medical sales techniques\n  Responsibilities: Focus on medical equipment or devices sales to healthcare facilities and providers. Conduct product demonstrations and training. Understand and comply with industry regulations.\n  "
    },
    {
        "Experience":"2 to 11 Years",
        "Qualifications":"M.Tech",
        "Salary Range":"$56K-$93K",
        "Job Title":"Office Manager",
        "Role":"Office Coordinator",
        "Job Description":"Office Coordinators provide administrative support within an office. They assist with tasks like scheduling, record-keeping, and communication to ensure efficient office operations.",
        "skills":"Office administration Calendar management Reception duties Communication skills Record keeping Office supplies management",
        "Responsibilities":"Coordinate office activities and workflow. Assist with document management and filing. Manage office supplies and vendor relationships.",
        "Summary":"\n  Job Tile: Office Manager\n  Job Description: Office Coordinators provide administrative support within an office. They assist with tasks like scheduling, record-keeping, and communication to ensure efficient office operations.\n  Qualification: M.Tech\n  Experience: 2 to 11 Years\n  Skills: Office administration Calendar management Reception duties Communication skills Record keeping Office supplies management\n  Responsibilities: Coordinate office activities and workflow. Assist with document management and filing. Manage office supplies and vendor relationships.\n  "
    },
    {
        "Experience":"1 to 10 Years",
        "Qualifications":"MBA",
        "Salary Range":"$61K-$109K",
        "Job Title":"Architect",
        "Role":"Project Architect",
        "Job Description":"Project Architects lead architectural projects, from concept to completion, coordinating design teams, managing budgets, and ensuring compliance with regulations.",
        "skills":"Architectural project management Construction documents Building systems Design coordination Client communication",
        "Responsibilities":"Lead architectural projects, from concept design to construction supervision. Collaborate with clients, engineers, and contractors. Develop project timelines and budgets.",
        "Summary":"\n  Job Tile: Architect\n  Job Description: Project Architects lead architectural projects, from concept to completion, coordinating design teams, managing budgets, and ensuring compliance with regulations.\n  Qualification: MBA\n  Experience: 1 to 10 Years\n  Skills: Architectural project management Construction documents Building systems Design coordination Client communication\n  Responsibilities: Lead architectural projects, from concept design to construction supervision. Collaborate with clients, engineers, and contractors. Develop project timelines and budgets.\n  "
    },
    {
        "Experience":"2 to 11 Years",
        "Qualifications":"MCA",
        "Salary Range":"$57K-$93K",
        "Job Title":"Physician Assistant",
        "Role":"Surgical Physician Assistant",
        "Job Description":"Assist surgeons in the operating room, perform pre- and post-operative care, and collaborate on surgical procedures.",
        "skills":"Surgical procedures and techniques Operating room protocols Anesthesia management",
        "Responsibilities":"Assist surgeons in the operating room, including pre-operative and post-operative care. Suture wounds and provide surgical support. Collaborate with surgical teams on patient care.",
        "Summary":"\n  Job Tile: Physician Assistant\n  Job Description: Assist surgeons in the operating room, perform pre- and post-operative care, and collaborate on surgical procedures.\n  Qualification: MCA\n  Experience: 2 to 11 Years\n  Skills: Surgical procedures and techniques Operating room protocols Anesthesia management\n  Responsibilities: Assist surgeons in the operating room, including pre-operative and post-operative care. Suture wounds and provide surgical support. Collaborate with surgical teams on patient care.\n  "
    },
    {
        "Experience":"3 to 13 Years",
        "Qualifications":"BBA",
        "Salary Range":"$64K-$95K",
        "Job Title":"Marketing Director",
        "Role":"Brand Director",
        "Job Description":"Brand Directors oversee brand management and strategy. They ensure brand consistency, guide marketing initiatives, and work to enhance brand perception and recognition.",
        "skills":"Brand strategy Brand development Creative direction Brand management Market research",
        "Responsibilities":"Manage and strengthen brand identity, ensuring consistent messaging and visual identity. Develop brand campaigns and positioning. Monitor brand performance and reputation.",
        "Summary":"\n  Job Tile: Marketing Director\n  Job Description: Brand Directors oversee brand management and strategy. They ensure brand consistency, guide marketing initiatives, and work to enhance brand perception and recognition.\n  Qualification: BBA\n  Experience: 3 to 13 Years\n  Skills: Brand strategy Brand development Creative direction Brand management Market research\n  Responsibilities: Manage and strengthen brand identity, ensuring consistent messaging and visual identity. Develop brand campaigns and positioning. Monitor brand performance and reputation.\n  "
    },
    {
        "Experience":"4 to 13 Years",
        "Qualifications":"MBA",
        "Salary Range":"$59K-$115K",
        "Job Title":"Front-End Developer",
        "Role":"Accessibility Developer",
        "Job Description":"An Accessibility Developer focuses on making digital products and websites accessible to individuals with disabilities, ensuring compliance with accessibility standards.",
        "skills":"Web accessibility standards (e.g., WCAG) Assistive technologies Accessibility testing tools HTML and CSS for accessibility ARIA (Accessible Rich Internet Applications) User experience (UX) for accessibility Usability testing with individuals with disabilities Collaboration Attention to detail",
        "Responsibilities":"Ensure web accessibility for all users, including those with disabilities. Implement WCAG guidelines and accessibility features. Conduct accessibility testing and remediation.",
        "Summary":"\n  Job Tile: Front-End Developer\n  Job Description: An Accessibility Developer focuses on making digital products and websites accessible to individuals with disabilities, ensuring compliance with accessibility standards.\n  Qualification: MBA\n  Experience: 4 to 13 Years\n  Skills: Web accessibility standards (e.g., WCAG) Assistive technologies Accessibility testing tools HTML and CSS for accessibility ARIA (Accessible Rich Internet Applications) User experience (UX) for accessibility Usability testing with individuals with disabilities Collaboration Attention to detail\n  Responsibilities: Ensure web accessibility for all users, including those with disabilities. Implement WCAG guidelines and accessibility features. Conduct accessibility testing and remediation.\n  "
    },
    {
        "Experience":"5 to 14 Years",
        "Qualifications":"BA",
        "Salary Range":"$59K-$87K",
        "Job Title":"Research Scientist",
        "Role":"Senior Researcher",
        "Job Description":"Senior Researchers lead research initiatives within organizations. They design research projects, collect and analyze data, and provide insights to inform strategic decision-making and innovation efforts.",
        "skills":"Research methodologies and data analysis Literature review and synthesis Statistical analysis software (e.g., SPSS, R) Research proposal development Strong communication and reporting skills",
        "Responsibilities":"Plan and conduct scientific research projects, including experimental design and data analysis. Collaborate with cross-functional teams and provide technical expertise. Publish research findings in peer-reviewed journals.",
        "Summary":"\n  Job Tile: Research Scientist\n  Job Description: Senior Researchers lead research initiatives within organizations. They design research projects, collect and analyze data, and provide insights to inform strategic decision-making and innovation efforts.\n  Qualification: BA\n  Experience: 5 to 14 Years\n  Skills: Research methodologies and data analysis Literature review and synthesis Statistical analysis software (e.g., SPSS, R) Research proposal development Strong communication and reporting skills\n  Responsibilities: Plan and conduct scientific research projects, including experimental design and data analysis. Collaborate with cross-functional teams and provide technical expertise. Publish research findings in peer-reviewed journals.\n  "
    },
    {
        "Experience":"5 to 14 Years",
        "Qualifications":"M.Tech",
        "Salary Range":"$56K-$110K",
        "Job Title":"Executive Assistant",
        "Role":"Office Manager",
        "Job Description":"Office Managers oversee daily office operations, including supervising staff, managing facilities, and ensuring efficient workflow. They may also handle budgeting, resource allocation, and office policies.",
        "skills":"Office administration and management Budgeting and expense tracking Team coordination and supervision Facility management Vendor and supplier relations",
        "Responsibilities":"Oversee office operations, including facilities management and vendor relations. Manage office budgets and expenses. Coordinate office events and logistics.",
        "Summary":"\n  Job Tile: Executive Assistant\n  Job Description: Office Managers oversee daily office operations, including supervising staff, managing facilities, and ensuring efficient workflow. They may also handle budgeting, resource allocation, and office policies.\n  Qualification: M.Tech\n  Experience: 5 to 14 Years\n  Skills: Office administration and management Budgeting and expense tracking Team coordination and supervision Facility management Vendor and supplier relations\n  Responsibilities: Oversee office operations, including facilities management and vendor relations. Manage office budgets and expenses. Coordinate office events and logistics.\n  "
    },
    {
        "Experience":"1 to 11 Years",
        "Qualifications":"MBA",
        "Salary Range":"$59K-$125K",
        "Job Title":"HR Manager",
        "Role":"Human Resources Director",
        "Job Description":"A Human Resources Director leads HR functions, including talent acquisition, employee development, and HR strategy, to promote a positive work environment and support organizational goals.",
        "skills":"Strategic HR planning Employee relations Talent management HR policy development Leadership skills",
        "Responsibilities":"Oversee all HR functions, including recruitment, benefits administration, employee relations, and policy development. Align HR strategies with business goals. Provide leadership to the HR team.",
        "Summary":"\n  Job Tile: HR Manager\n  Job Description: A Human Resources Director leads HR functions, including talent acquisition, employee development, and HR strategy, to promote a positive work environment and support organizational goals.\n  Qualification: MBA\n  Experience: 1 to 11 Years\n  Skills: Strategic HR planning Employee relations Talent management HR policy development Leadership skills\n  Responsibilities: Oversee all HR functions, including recruitment, benefits administration, employee relations, and policy development. Align HR strategies with business goals. Provide leadership to the HR team.\n  "
    },
    {
        "Experience":"3 to 15 Years",
        "Qualifications":"M.Com",
        "Salary Range":"$56K-$127K",
        "Job Title":"Marketing Manager",
        "Role":"Brand Manager",
        "Job Description":"Brand Managers are responsible for maintaining and enhancing a brands image and reputation. They develop brand strategies, oversee branding campaigns, and ensure brand consistency in all marketing and communication efforts.",
        "skills":"Brand strategy development Brand identity and design Brand storytelling Marketing campaigns Brand performance measurement Creative thinking Strong communication skills",
        "Responsibilities":"Manage the overall brand identity, create marketing campaigns, and ensure brand consistency across all materials and touchpoints. Monitor brand performance and reputation. Collaborate with creative teams on branding materials.",
        "Summary":"\n  Job Tile: Marketing Manager\n  Job Description: Brand Managers are responsible for maintaining and enhancing a brands image and reputation. They develop brand strategies, oversee branding campaigns, and ensure brand consistency in all marketing and communication efforts.\n  Qualification: M.Com\n  Experience: 3 to 15 Years\n  Skills: Brand strategy development Brand identity and design Brand storytelling Marketing campaigns Brand performance measurement Creative thinking Strong communication skills\n  Responsibilities: Manage the overall brand identity, create marketing campaigns, and ensure brand consistency across all materials and touchpoints. Monitor brand performance and reputation. Collaborate with creative teams on branding materials.\n  "
    },
    {
        "Experience":"3 to 14 Years",
        "Qualifications":"BCA",
        "Salary Range":"$55K-$119K",
        "Job Title":"Public Relations Specialist",
        "Role":"Brand PR Specialist",
        "Job Description":"Brand PR Specialists focus on promoting and maintaining a positive brand image through media relations, events, and communication efforts.",
        "skills":"Brand management Public relations Brand storytelling Influencer marketing Media monitoring",
        "Responsibilities":"Promote and protect the brands image and reputation. Develop PR campaigns and brand messaging. Monitor and analyze PR campaign performance.",
        "Summary":"\n  Job Tile: Public Relations Specialist\n  Job Description: Brand PR Specialists focus on promoting and maintaining a positive brand image through media relations, events, and communication efforts.\n  Qualification: BCA\n  Experience: 3 to 14 Years\n  Skills: Brand management Public relations Brand storytelling Influencer marketing Media monitoring\n  Responsibilities: Promote and protect the brands image and reputation. Develop PR campaigns and brand messaging. Monitor and analyze PR campaign performance.\n  "
    },
    {
        "Experience":"4 to 11 Years",
        "Qualifications":"BBA",
        "Salary Range":"$55K-$98K",
        "Job Title":"Financial Controller",
        "Role":"Finance Manager",
        "Job Description":"Finance Managers oversee an organizations financial operations, including budgeting, financial reporting, and investment management. They analyze financial data, make strategic financial decisions, and ensure compliance with financial regulations.",
        "skills":"Financial management Budgeting Financial analysis Financial reporting Risk management Financial software (e.g., Excel, QuickBooks) Strategic planning",
        "Responsibilities":"Oversee financial operations, including budgeting, financial reporting, and cash flow management. Ensure compliance with accounting standards and regulations. Supervise finance staff.",
        "Summary":"\n  Job Tile: Financial Controller\n  Job Description: Finance Managers oversee an organizations financial operations, including budgeting, financial reporting, and investment management. They analyze financial data, make strategic financial decisions, and ensure compliance with financial regulations.\n  Qualification: BBA\n  Experience: 4 to 11 Years\n  Skills: Financial management Budgeting Financial analysis Financial reporting Risk management Financial software (e.g., Excel, QuickBooks) Strategic planning\n  Responsibilities: Oversee financial operations, including budgeting, financial reporting, and cash flow management. Ensure compliance with accounting standards and regulations. Supervise finance staff.\n  "
    },
    {
        "Experience":"0 to 11 Years",
        "Qualifications":"B.Tech",
        "Salary Range":"$63K-$111K",
        "Job Title":"Investment Advisor",
        "Role":"Wealth Advisor",
        "Job Description":"Wealth Advisors provide financial advice to clients. They assess financial goals, create investment strategies, and offer guidance on wealth management and financial planning.",
        "skills":"Financial planning Investment knowledge Relationship management Communication skills Analytical skills",
        "Responsibilities":"Provide financial advice and investment strategies to clients. Assess clients financial goals and risk tolerance. Create personalized investment portfolios.",
        "Summary":"\n  Job Tile: Investment Advisor\n  Job Description: Wealth Advisors provide financial advice to clients. They assess financial goals, create investment strategies, and offer guidance on wealth management and financial planning.\n  Qualification: B.Tech\n  Experience: 0 to 11 Years\n  Skills: Financial planning Investment knowledge Relationship management Communication skills Analytical skills\n  Responsibilities: Provide financial advice and investment strategies to clients. Assess clients financial goals and risk tolerance. Create personalized investment portfolios.\n  "
    },
    {
        "Experience":"2 to 14 Years",
        "Qualifications":"MBA",
        "Salary Range":"$61K-$94K",
        "Job Title":"Aerospace Engineer",
        "Role":"Systems Engineer",
        "Job Description":"Systems Engineers design and manage complex systems and infrastructure. They integrate various components and technologies to ensure optimal system performance and reliability.",
        "skills":"Systems engineering System architecture Integration testing Troubleshooting Technical documentation Configuration management",
        "Responsibilities":"Work on aerospace systems integration and optimization. Address system safety and reliability. Collaborate with multidisciplinary teams.",
        "Summary":"\n  Job Tile: Aerospace Engineer\n  Job Description: Systems Engineers design and manage complex systems and infrastructure. They integrate various components and technologies to ensure optimal system performance and reliability.\n  Qualification: MBA\n  Experience: 2 to 14 Years\n  Skills: Systems engineering System architecture Integration testing Troubleshooting Technical documentation Configuration management\n  Responsibilities: Work on aerospace systems integration and optimization. Address system safety and reliability. Collaborate with multidisciplinary teams.\n  "
    },
    {
        "Experience":"5 to 13 Years",
        "Qualifications":"B.Com",
        "Salary Range":"$55K-$111K",
        "Job Title":"Marketing Analyst",
        "Role":"Data Analyst",
        "Job Description":"Analyze data sets, generate insights, and provide data-driven recommendations to inform business decisions.",
        "skills":"Data analysis tools (e.g., SQL, Python) Data visualization tools (e.g., Tableau, Power BI) Statistical analysis Data cleansing and transformation Data modeling Communication of data insights Problem-solving Attention to detail Business acumen",
        "Responsibilities":"Analyze marketing data to measure campaign performance and ROI. Provide insights for marketing strategy adjustments. Create data visualizations and dashboards.",
        "Summary":"\n  Job Tile: Marketing Analyst\n  Job Description: Analyze data sets, generate insights, and provide data-driven recommendations to inform business decisions.\n  Qualification: B.Com\n  Experience: 5 to 13 Years\n  Skills: Data analysis tools (e.g., SQL, Python) Data visualization tools (e.g., Tableau, Power BI) Statistical analysis Data cleansing and transformation Data modeling Communication of data insights Problem-solving Attention to detail Business acumen\n  Responsibilities: Analyze marketing data to measure campaign performance and ROI. Provide insights for marketing strategy adjustments. Create data visualizations and dashboards.\n  "
    },
    {
        "Experience":"5 to 8 Years",
        "Qualifications":"M.Tech",
        "Salary Range":"$55K-$115K",
        "Job Title":"Paralegal",
        "Role":"Real Estate Paralegal",
        "Job Description":"Assist in real estate transactions, including title searches, closings, and contract preparation.",
        "skills":"Real estate transactions Title searches Closing processes Deed preparation Contract review Communication with real estate professionals Attention to detail Real estate terminology Technology proficiency Legal software proficiency Legal research skills",
        "Responsibilities":"Specialize in real estate transactions, including title searches, closings, and document preparation. Research property records and zoning regulations. Coordinate real estate transactions.",
        "Summary":"\n  Job Tile: Paralegal\n  Job Description: Assist in real estate transactions, including title searches, closings, and contract preparation.\n  Qualification: M.Tech\n  Experience: 5 to 8 Years\n  Skills: Real estate transactions Title searches Closing processes Deed preparation Contract review Communication with real estate professionals Attention to detail Real estate terminology Technology proficiency Legal software proficiency Legal research skills\n  Responsibilities: Specialize in real estate transactions, including title searches, closings, and document preparation. Research property records and zoning regulations. Coordinate real estate transactions.\n  "
    },
    {
        "Experience":"5 to 14 Years",
        "Qualifications":"M.Com",
        "Salary Range":"$55K-$121K",
        "Job Title":"Landscape Designer",
        "Role":"Commercial Landscape Architect",
        "Job Description":"Commercial Landscape Architects design outdoor spaces for commercial properties, such as office complexes and retail centers. They create functional and aesthetically pleasing landscapes that align with the clients goals and needs.",
        "skills":"Landscape architecture Site planning Plant selection Environmental sustainability AutoCAD Project management",
        "Responsibilities":"Plan and design outdoor spaces for commercial and public projects, such as parks, resorts, and urban developments. Manage project budgets and timelines. Collaborate with architects and contractors.",
        "Summary":"\n  Job Tile: Landscape Designer\n  Job Description: Commercial Landscape Architects design outdoor spaces for commercial properties, such as office complexes and retail centers. They create functional and aesthetically pleasing landscapes that align with the clients goals and needs.\n  Qualification: M.Com\n  Experience: 5 to 14 Years\n  Skills: Landscape architecture Site planning Plant selection Environmental sustainability AutoCAD Project management\n  Responsibilities: Plan and design outdoor spaces for commercial and public projects, such as parks, resorts, and urban developments. Manage project budgets and timelines. Collaborate with architects and contractors.\n  "
    },
    {
        "Experience":"2 to 9 Years",
        "Qualifications":"M.Tech",
        "Salary Range":"$59K-$89K",
        "Job Title":"Web Designer",
        "Role":"Frontend Web Designer",
        "Job Description":"Frontend Web Designers create the visual elements and user interfaces of websites. They use HTML, CSS, and JavaScript to design responsive, user-friendly web pages, ensuring a seamless and visually appealing online experience.",
        "skills":"Frontend web development HTML\/CSS Responsive design User interface (UI) design Adobe Creative Suite Collaboration skills",
        "Responsibilities":"Create visually appealing and responsive web designs using HTML, CSS, and JavaScript. Ensure cross-browser compatibility. Optimize web performance and page load times.",
        "Summary":"\n  Job Tile: Web Designer\n  Job Description: Frontend Web Designers create the visual elements and user interfaces of websites. They use HTML, CSS, and JavaScript to design responsive, user-friendly web pages, ensuring a seamless and visually appealing online experience.\n  Qualification: M.Tech\n  Experience: 2 to 9 Years\n  Skills: Frontend web development HTML\/CSS Responsive design User interface (UI) design Adobe Creative Suite Collaboration skills\n  Responsibilities: Create visually appealing and responsive web designs using HTML, CSS, and JavaScript. Ensure cross-browser compatibility. Optimize web performance and page load times.\n  "
    },
    {
        "Experience":"0 to 13 Years",
        "Qualifications":"M.Com",
        "Salary Range":"$64K-$120K",
        "Job Title":"Occupational Therapist",
        "Role":"Pediatric Occupational Therapist",
        "Job Description":"A Pediatric Occupational Therapist helps children with developmental or physical challenges improve their motor and life skills through therapy interventions.",
        "skills":"Pediatric assessment and evaluation Occupational therapy techniques for children Developmental milestones Sensory integration therapy Pediatric psychology Family-centered care Individualized treatment plans Communication skills Pediatric healthcare knowledge",
        "Responsibilities":"Provide occupational therapy services to children with developmental or sensory challenges. Develop individualized therapy plans. Collaborate with parents and caregivers.",
        "Summary":"\n  Job Tile: Occupational Therapist\n  Job Description: A Pediatric Occupational Therapist helps children with developmental or physical challenges improve their motor and life skills through therapy interventions.\n  Qualification: M.Com\n  Experience: 0 to 13 Years\n  Skills: Pediatric assessment and evaluation Occupational therapy techniques for children Developmental milestones Sensory integration therapy Pediatric psychology Family-centered care Individualized treatment plans Communication skills Pediatric healthcare knowledge\n  Responsibilities: Provide occupational therapy services to children with developmental or sensory challenges. Develop individualized therapy plans. Collaborate with parents and caregivers.\n  "
    },
    {
        "Experience":"2 to 15 Years",
        "Qualifications":"PhD",
        "Salary Range":"$55K-$107K",
        "Job Title":"Legal Advisor",
        "Role":"In-House Counsel",
        "Job Description":"In the role of In-House Counsel, you will provide legal support to the organization across various areas, including contracts, employment law, and regulatory compliance. You will draft legal documents, handle litigation matters, and advise on legal risks affecting day-to-day operations. Your role is crucial in ensuring the company operates within the bounds of the law.",
        "skills":"In-house counsel Legal advisory Employment law Intellectual property Regulatory compliance Dispute resolution Contract review Client counseling",
        "Responsibilities":"Serve as in-house legal counsel for organizations, managing legal issues and contracts internally. Provide legal training to staff and address legal questions and concerns.",
        "Summary":"\n  Job Tile: Legal Advisor\n  Job Description: In the role of In-House Counsel, you will provide legal support to the organization across various areas, including contracts, employment law, and regulatory compliance. You will draft legal documents, handle litigation matters, and advise on legal risks affecting day-to-day operations. Your role is crucial in ensuring the company operates within the bounds of the law.\n  Qualification: PhD\n  Experience: 2 to 15 Years\n  Skills: In-house counsel Legal advisory Employment law Intellectual property Regulatory compliance Dispute resolution Contract review Client counseling\n  Responsibilities: Serve as in-house legal counsel for organizations, managing legal issues and contracts internally. Provide legal training to staff and address legal questions and concerns.\n  "
    },
    {
        "Experience":"5 to 14 Years",
        "Qualifications":"PhD",
        "Salary Range":"$55K-$98K",
        "Job Title":"Marketing Coordinator",
        "Role":"Marketing Specialist",
        "Job Description":"Marketing Specialists develop and implement marketing campaigns, analyze market trends, and promote products or services to target audiences.",
        "skills":"Market research and analysis Content creation and copywriting Social media management SEO and digital marketing Marketing automation tools proficiency",
        "Responsibilities":"Assist in the development and execution of marketing campaigns and strategies. Create marketing collateral and content. Monitor and report on marketing performance metrics.",
        "Summary":"\n  Job Tile: Marketing Coordinator\n  Job Description: Marketing Specialists develop and implement marketing campaigns, analyze market trends, and promote products or services to target audiences.\n  Qualification: PhD\n  Experience: 5 to 14 Years\n  Skills: Market research and analysis Content creation and copywriting Social media management SEO and digital marketing Marketing automation tools proficiency\n  Responsibilities: Assist in the development and execution of marketing campaigns and strategies. Create marketing collateral and content. Monitor and report on marketing performance metrics.\n  "
    },
    {
        "Experience":"5 to 8 Years",
        "Qualifications":"BA",
        "Salary Range":"$59K-$100K",
        "Job Title":"Dental Hygienist",
        "Role":"Dental Hygiene Educator",
        "Job Description":"A Dental Hygiene Educator teaches dental hygiene practices and oral health to students or the community. They promote preventive care and raise awareness about dental health.",
        "skills":"Dental hygiene knowledge Teaching and instructional skills Curriculum development Student assessment Clinical practice experience",
        "Responsibilities":"Educate patients on oral hygiene practices and preventive care. Provide oral health instruction and advice. Develop and deliver educational programs.",
        "Summary":"\n  Job Tile: Dental Hygienist\n  Job Description: A Dental Hygiene Educator teaches dental hygiene practices and oral health to students or the community. They promote preventive care and raise awareness about dental health.\n  Qualification: BA\n  Experience: 5 to 8 Years\n  Skills: Dental hygiene knowledge Teaching and instructional skills Curriculum development Student assessment Clinical practice experience\n  Responsibilities: Educate patients on oral hygiene practices and preventive care. Provide oral health instruction and advice. Develop and deliver educational programs.\n  "
    },
    {
        "Experience":"2 to 8 Years",
        "Qualifications":"B.Com",
        "Salary Range":"$64K-$84K",
        "Job Title":"SEM Specialist",
        "Role":"SEM Analyst",
        "Job Description":"SEM Analysts analyze search engine marketing (SEM) campaigns. They monitor performance, optimize keyword strategies, and provide insights to improve the effectiveness of SEM efforts.",
        "skills":"Search engine marketing (SEM) Google Ads Bing Ads Keyword analysis Ad performance analysis SEM strategy development Bid management",
        "Responsibilities":"Analyze SEM data and trends to optimize campaigns and ad spend. Generate reports and insights to improve SEM strategies. Stay up-to-date with SEM industry changes and best practices.",
        "Summary":"\n  Job Tile: SEM Specialist\n  Job Description: SEM Analysts analyze search engine marketing (SEM) campaigns. They monitor performance, optimize keyword strategies, and provide insights to improve the effectiveness of SEM efforts.\n  Qualification: B.Com\n  Experience: 2 to 8 Years\n  Skills: Search engine marketing (SEM) Google Ads Bing Ads Keyword analysis Ad performance analysis SEM strategy development Bid management\n  Responsibilities: Analyze SEM data and trends to optimize campaigns and ad spend. Generate reports and insights to improve SEM strategies. Stay up-to-date with SEM industry changes and best practices.\n  "
    },
    {
        "Experience":"4 to 15 Years",
        "Qualifications":"PhD",
        "Salary Range":"$57K-$126K",
        "Job Title":"SEO Specialist",
        "Role":"Technical SEO Specialist",
        "Job Description":"Technical SEO Specialists optimize website infrastructure, addressing issues like site speed, mobile-friendliness, and structured data to enhance search engine visibility.",
        "skills":"Technical SEO audits Website crawl analysis Schema markup XML sitemaps Canonicalization",
        "Responsibilities":"Identify and resolve technical SEO issues, such as crawl errors, website speed, and mobile-friendliness. Implement schema markup and structured data. Ensure website indexing and sitemap accuracy.",
        "Summary":"\n  Job Tile: SEO Specialist\n  Job Description: Technical SEO Specialists optimize website infrastructure, addressing issues like site speed, mobile-friendliness, and structured data to enhance search engine visibility.\n  Qualification: PhD\n  Experience: 4 to 15 Years\n  Skills: Technical SEO audits Website crawl analysis Schema markup XML sitemaps Canonicalization\n  Responsibilities: Identify and resolve technical SEO issues, such as crawl errors, website speed, and mobile-friendliness. Implement schema markup and structured data. Ensure website indexing and sitemap accuracy.\n  "
    },
    {
        "Experience":"4 to 9 Years",
        "Qualifications":"MBA",
        "Salary Range":"$57K-$102K",
        "Job Title":"Pediatrician",
        "Role":"Pediatric Surgeon",
        "Job Description":"Pediatric Surgeons specialize in performing surgical procedures on children, including infants and adolescents. They diagnose surgical conditions, perform surgeries, and collaborate with other healthcare professionals to ensure the best outcomes.",
        "skills":"Pediatric surgery Surgical procedures for children Operating room protocols Patient care Surgical techniques Pediatric anesthesia",
        "Responsibilities":"Perform surgical procedures on pediatric patients, including congenital abnormalities and injuries. Coordinate pre-operative and post-operative care. Ensure the well-being and recovery of young patients.",
        "Summary":"\n  Job Tile: Pediatrician\n  Job Description: Pediatric Surgeons specialize in performing surgical procedures on children, including infants and adolescents. They diagnose surgical conditions, perform surgeries, and collaborate with other healthcare professionals to ensure the best outcomes.\n  Qualification: MBA\n  Experience: 4 to 9 Years\n  Skills: Pediatric surgery Surgical procedures for children Operating room protocols Patient care Surgical techniques Pediatric anesthesia\n  Responsibilities: Perform surgical procedures on pediatric patients, including congenital abnormalities and injuries. Coordinate pre-operative and post-operative care. Ensure the well-being and recovery of young patients.\n  "
    },
    {
        "Experience":"5 to 12 Years",
        "Qualifications":"M.Com",
        "Salary Range":"$61K-$90K",
        "Job Title":"QA Engineer",
        "Role":"QA Manager",
        "Job Description":"A QA Manager is responsible for leading and managing the quality assurance team. They ensure product quality, develop and implement QA processes, and maintain quality standards.",
        "skills":"Quality assurance Process improvement Team leadership Problem-solving Quality control",
        "Responsibilities":"Lead and manage the QA team, including test planning, resource allocation, and test strategy development. Define quality standards and metrics. Oversee QA processes and continuous improvement efforts.",
        "Summary":"\n  Job Tile: QA Engineer\n  Job Description: A QA Manager is responsible for leading and managing the quality assurance team. They ensure product quality, develop and implement QA processes, and maintain quality standards.\n  Qualification: M.Com\n  Experience: 5 to 12 Years\n  Skills: Quality assurance Process improvement Team leadership Problem-solving Quality control\n  Responsibilities: Lead and manage the QA team, including test planning, resource allocation, and test strategy development. Define quality standards and metrics. Oversee QA processes and continuous improvement efforts.\n  "
    },
    {
        "Experience":"4 to 9 Years",
        "Qualifications":"BA",
        "Salary Range":"$55K-$111K",
        "Job Title":"Data Scientist",
        "Role":"Machine Learning Engineer",
        "Job Description":"Machine Learning Engineers develop machine learning models and algorithms, working on tasks like data preprocessing, model training, and deployment.",
        "skills":"Machine learning algorithms Python programming Data preprocessing Deep learning Model evaluation",
        "Responsibilities":"Develop machine learning models and algorithms for data analysis and prediction. Preprocess and clean data for model training. Evaluate model performance and fine-tune parameters.",
        "Summary":"\n  Job Tile: Data Scientist\n  Job Description: Machine Learning Engineers develop machine learning models and algorithms, working on tasks like data preprocessing, model training, and deployment.\n  Qualification: BA\n  Experience: 4 to 9 Years\n  Skills: Machine learning algorithms Python programming Data preprocessing Deep learning Model evaluation\n  Responsibilities: Develop machine learning models and algorithms for data analysis and prediction. Preprocess and clean data for model training. Evaluate model performance and fine-tune parameters.\n  "
    },
    {
        "Experience":"4 to 11 Years",
        "Qualifications":"M.Com",
        "Salary Range":"$57K-$110K",
        "Job Title":"Financial Advisor",
        "Role":"Wealth Management Advisor",
        "Job Description":"Wealth Management Advisors provide comprehensive financial planning and investment management services to high-net-worth individuals and families.",
        "skills":"Wealth management strategies Asset allocation Estate planning Tax management Client relationship management",
        "Responsibilities":"Manage high-net-worth clients financial portfolios and assets. Offer comprehensive wealth management services, including estate planning and asset allocation. Provide personalized financial guidance.",
        "Summary":"\n  Job Tile: Financial Advisor\n  Job Description: Wealth Management Advisors provide comprehensive financial planning and investment management services to high-net-worth individuals and families.\n  Qualification: M.Com\n  Experience: 4 to 11 Years\n  Skills: Wealth management strategies Asset allocation Estate planning Tax management Client relationship management\n  Responsibilities: Manage high-net-worth clients financial portfolios and assets. Offer comprehensive wealth management services, including estate planning and asset allocation. Provide personalized financial guidance.\n  "
    },
    {
        "Experience":"4 to 10 Years",
        "Qualifications":"MBA",
        "Salary Range":"$63K-$109K",
        "Job Title":"Personal Assistant",
        "Role":"Personal Secretary",
        "Job Description":"Personal Secretaries provide administrative support to individuals or executives. They manage schedules, handle correspondence, and assist with various tasks to ensure efficiency.",
        "skills":"Administrative support Calendar management Communication skills Time management Organizational skills Confidentiality",
        "Responsibilities":"Act as a personal secretary, managing personal appointments and tasks. Handle correspondence and communication on behalf of the employer. Organize personal schedules and commitments.",
        "Summary":"\n  Job Tile: Personal Assistant\n  Job Description: Personal Secretaries provide administrative support to individuals or executives. They manage schedules, handle correspondence, and assist with various tasks to ensure efficiency.\n  Qualification: MBA\n  Experience: 4 to 10 Years\n  Skills: Administrative support Calendar management Communication skills Time management Organizational skills Confidentiality\n  Responsibilities: Act as a personal secretary, managing personal appointments and tasks. Handle correspondence and communication on behalf of the employer. Organize personal schedules and commitments.\n  "
    },
    {
        "Experience":"5 to 15 Years",
        "Qualifications":"MBA",
        "Salary Range":"$60K-$125K",
        "Job Title":"SEO Analyst",
        "Role":"Technical SEO Analyst",
        "Job Description":"As a Technical SEO Analyst, your role is to analyze website performance and identify opportunities for optimization. You will work on improving site speed, mobile-friendliness, and other technical aspects to enhance search engine rankings. You will also perform keyword research, conduct competitive analysis, and provide recommendations to improve website SEO.",
        "skills":"Technical SEO Website audits SEO tools (e.g., Screaming Frog, Ahrefs) Schema markup Site speed optimization XML sitemaps Canonicalization",
        "Responsibilities":"Focus on technical aspects of SEO, including website structure, page speed, and mobile optimization. Conduct technical SEO audits and provide recommendations for website improvements. Collaborate with web developers on technical SEO implementations.",
        "Summary":"\n  Job Tile: SEO Analyst\n  Job Description: As a Technical SEO Analyst, your role is to analyze website performance and identify opportunities for optimization. You will work on improving site speed, mobile-friendliness, and other technical aspects to enhance search engine rankings. You will also perform keyword research, conduct competitive analysis, and provide recommendations to improve website SEO.\n  Qualification: MBA\n  Experience: 5 to 15 Years\n  Skills: Technical SEO Website audits SEO tools (e.g., Screaming Frog, Ahrefs) Schema markup Site speed optimization XML sitemaps Canonicalization\n  Responsibilities: Focus on technical aspects of SEO, including website structure, page speed, and mobile optimization. Conduct technical SEO audits and provide recommendations for website improvements. Collaborate with web developers on technical SEO implementations.\n  "
    },
    {
        "Experience":"1 to 12 Years",
        "Qualifications":"B.Tech",
        "Salary Range":"$56K-$118K",
        "Job Title":"Network Analyst",
        "Role":"Network Performance Analyst",
        "Job Description":"Network Performance Analysts monitor and optimize network performance. They collect and analyze network data, identify issues, and implement solutions to enhance network speed, reliability, and efficiency.",
        "skills":"Network performance analysis Network monitoring tools (e.g., Wireshark) Troubleshooting Capacity planning Data analysis Network protocols",
        "Responsibilities":"Analyze network performance data, identify bottlenecks and latency issues, and optimize network performance. Collaborate with network engineers to implement improvements.",
        "Summary":"\n  Job Tile: Network Analyst\n  Job Description: Network Performance Analysts monitor and optimize network performance. They collect and analyze network data, identify issues, and implement solutions to enhance network speed, reliability, and efficiency.\n  Qualification: B.Tech\n  Experience: 1 to 12 Years\n  Skills: Network performance analysis Network monitoring tools (e.g., Wireshark) Troubleshooting Capacity planning Data analysis Network protocols\n  Responsibilities: Analyze network performance data, identify bottlenecks and latency issues, and optimize network performance. Collaborate with network engineers to implement improvements.\n  "
    },
    {
        "Experience":"2 to 15 Years",
        "Qualifications":"M.Tech",
        "Salary Range":"$56K-$118K",
        "Job Title":"Mechanical Designer",
        "Role":"CAD Technician",
        "Job Description":"Create and modify technical drawings using computer-aided design (CAD) software for various engineering projects.",
        "skills":"Computer-aided design (CAD) software Technical drawing Blueprint interpretation Drafting standards Engineering principles Collaboration with engineers Problem-solving Attention to detail Communication skills 3D modeling (if applicable)",
        "Responsibilities":"Use computer-aided design (CAD) software to create and revise technical drawings. Ensure drawings comply with industry standards. Support design projects with technical expertise.",
        "Summary":"\n  Job Tile: Mechanical Designer\n  Job Description: Create and modify technical drawings using computer-aided design (CAD) software for various engineering projects.\n  Qualification: M.Tech\n  Experience: 2 to 15 Years\n  Skills: Computer-aided design (CAD) software Technical drawing Blueprint interpretation Drafting standards Engineering principles Collaboration with engineers Problem-solving Attention to detail Communication skills 3D modeling (if applicable)\n  Responsibilities: Use computer-aided design (CAD) software to create and revise technical drawings. Ensure drawings comply with industry standards. Support design projects with technical expertise.\n  "
    },
    {
        "Experience":"5 to 9 Years",
        "Qualifications":"MCA",
        "Salary Range":"$64K-$114K",
        "Job Title":"Marketing Specialist",
        "Role":"Marketing Analytics Specialist",
        "Job Description":"Marketing Analytics Specialists analyze marketing data to derive insights and inform marketing strategies. They use tools like Google Analytics and data analysis software to track campaign performance, customer behavior, and market trends.",
        "skills":"Marketing analytics Data analysis Data visualization Market research Google Analytics Marketing automation Reporting tools",
        "Responsibilities":"Analyze marketing data and generate insights to drive decision-making. Use tools like Google Analytics and marketing automation platforms. Report on key performance metrics and ROI.",
        "Summary":"\n  Job Tile: Marketing Specialist\n  Job Description: Marketing Analytics Specialists analyze marketing data to derive insights and inform marketing strategies. They use tools like Google Analytics and data analysis software to track campaign performance, customer behavior, and market trends.\n  Qualification: MCA\n  Experience: 5 to 9 Years\n  Skills: Marketing analytics Data analysis Data visualization Market research Google Analytics Marketing automation Reporting tools\n  Responsibilities: Analyze marketing data and generate insights to drive decision-making. Use tools like Google Analytics and marketing automation platforms. Report on key performance metrics and ROI.\n  "
    },
    {
        "Experience":"0 to 11 Years",
        "Qualifications":"BA",
        "Salary Range":"$61K-$117K",
        "Job Title":"Graphic Designer",
        "Role":"Print Graphic Designer",
        "Job Description":"Print Graphic Designers design graphics and layouts for printed materials such as brochures, posters, and packaging. They use their creativity and design skills to visually communicate messages and information effectively in printed form.",
        "skills":"Print design software (e.g., Adobe InDesign, Illustrator) Layout and composition Print production processes Color theory and management Attention to detail Print industry knowledge",
        "Responsibilities":"Design printed materials such as brochures, posters, and packaging. Choose appropriate printing methods and materials. Collaborate with print vendors and ensure quality output.",
        "Summary":"\n  Job Tile: Graphic Designer\n  Job Description: Print Graphic Designers design graphics and layouts for printed materials such as brochures, posters, and packaging. They use their creativity and design skills to visually communicate messages and information effectively in printed form.\n  Qualification: BA\n  Experience: 0 to 11 Years\n  Skills: Print design software (e.g., Adobe InDesign, Illustrator) Layout and composition Print production processes Color theory and management Attention to detail Print industry knowledge\n  Responsibilities: Design printed materials such as brochures, posters, and packaging. Choose appropriate printing methods and materials. Collaborate with print vendors and ensure quality output.\n  "
    },
    {
        "Experience":"4 to 12 Years",
        "Qualifications":"BA",
        "Salary Range":"$55K-$105K",
        "Job Title":"Finance Manager",
        "Role":"Accounting Manager",
        "Job Description":"Accounting Managers supervise accounting teams. They ensure accurate financial reporting, manage budgets, and oversee financial transactions and compliance with accounting standards.",
        "skills":"Accounting principles Financial reporting Team management Budgeting Financial analysis",
        "Responsibilities":"Manage accounting functions, including financial reporting and compliance. Ensure accurate and timely financial statements. Oversee audits and tax filings.",
        "Summary":"\n  Job Tile: Finance Manager\n  Job Description: Accounting Managers supervise accounting teams. They ensure accurate financial reporting, manage budgets, and oversee financial transactions and compliance with accounting standards.\n  Qualification: BA\n  Experience: 4 to 12 Years\n  Skills: Accounting principles Financial reporting Team management Budgeting Financial analysis\n  Responsibilities: Manage accounting functions, including financial reporting and compliance. Ensure accurate and timely financial statements. Oversee audits and tax filings.\n  "
    },
    {
        "Experience":"0 to 10 Years",
        "Qualifications":"M.Com",
        "Salary Range":"$63K-$99K",
        "Job Title":"Physical Therapist",
        "Role":"Pediatric Physical Therapist",
        "Job Description":"Specialize in providing physical therapy to children, addressing developmental and mobility issues.",
        "skills":"Pediatric rehabilitation Developmental assessments Child psychology knowledge",
        "Responsibilities":"Work with children with developmental or physical disabilities. Provide therapy to improve mobility and motor skills. Collaborate with parents and caregivers.",
        "Summary":"\n  Job Tile: Physical Therapist\n  Job Description: Specialize in providing physical therapy to children, addressing developmental and mobility issues.\n  Qualification: M.Com\n  Experience: 0 to 10 Years\n  Skills: Pediatric rehabilitation Developmental assessments Child psychology knowledge\n  Responsibilities: Work with children with developmental or physical disabilities. Provide therapy to improve mobility and motor skills. Collaborate with parents and caregivers.\n  "
    },
    {
        "Experience":"0 to 14 Years",
        "Qualifications":"BBA",
        "Salary Range":"$64K-$113K",
        "Job Title":"Product Designer",
        "Role":"Industrial Designer",
        "Job Description":"An Industrial Designer creates and improves product designs, focusing on aesthetics, functionality, and user experience to produce innovative and marketable products.",
        "skills":"Industrial design principles CAD and 3D modeling Prototyping and testing",
        "Responsibilities":"Focus on the physical design and aesthetics of products. Develop product concepts, sketches, and 3D models. Collaborate with engineers for product feasibility.",
        "Summary":"\n  Job Tile: Product Designer\n  Job Description: An Industrial Designer creates and improves product designs, focusing on aesthetics, functionality, and user experience to produce innovative and marketable products.\n  Qualification: BBA\n  Experience: 0 to 14 Years\n  Skills: Industrial design principles CAD and 3D modeling Prototyping and testing\n  Responsibilities: Focus on the physical design and aesthetics of products. Develop product concepts, sketches, and 3D models. Collaborate with engineers for product feasibility.\n  "
    },
    {
        "Experience":"4 to 9 Years",
        "Qualifications":"M.Tech",
        "Salary Range":"$65K-$86K",
        "Job Title":"Administrative Assistant",
        "Role":"Executive Assistant",
        "Job Description":"Support high-level executives by managing schedules, coordinating meetings, and handling various administrative tasks.",
        "skills":"Calendar management Travel coordination Meeting scheduling Correspondence and communication Office organization Confidentiality Time management Problem-solving Attention to detail Communication skills Technology proficiency (e.g., MS Office)",
        "Responsibilities":"Provide high-level administrative support to executives, including managing schedules and communications. Coordinate meetings and travel arrangements. Handle confidential information with discretion.",
        "Summary":"\n  Job Tile: Administrative Assistant\n  Job Description: Support high-level executives by managing schedules, coordinating meetings, and handling various administrative tasks.\n  Qualification: M.Tech\n  Experience: 4 to 9 Years\n  Skills: Calendar management Travel coordination Meeting scheduling Correspondence and communication Office organization Confidentiality Time management Problem-solving Attention to detail Communication skills Technology proficiency (e.g., MS Office)\n  Responsibilities: Provide high-level administrative support to executives, including managing schedules and communications. Coordinate meetings and travel arrangements. Handle confidential information with discretion.\n  "
    },
    {
        "Experience":"4 to 10 Years",
        "Qualifications":"BA",
        "Salary Range":"$62K-$101K",
        "Job Title":"Brand Ambassador",
        "Role":"Social Media Influencer",
        "Job Description":"Social Media Influencers use their online presence to promote brands or products. They create engaging content and collaborate with companies to reach a wider audience.",
        "skills":"Social media management Content creation Audience engagement Marketing strategy Communication skills",
        "Responsibilities":"Build and maintain a strong social media presence and following. Create and share content related to the brand. Collaborate with brands for sponsored posts and partnerships.",
        "Summary":"\n  Job Tile: Brand Ambassador\n  Job Description: Social Media Influencers use their online presence to promote brands or products. They create engaging content and collaborate with companies to reach a wider audience.\n  Qualification: BA\n  Experience: 4 to 10 Years\n  Skills: Social media management Content creation Audience engagement Marketing strategy Communication skills\n  Responsibilities: Build and maintain a strong social media presence and following. Create and share content related to the brand. Collaborate with brands for sponsored posts and partnerships.\n  "
    },
    {
        "Experience":"0 to 11 Years",
        "Qualifications":"B.Tech",
        "Salary Range":"$63K-$123K",
        "Job Title":"Project Coordinator",
        "Role":"Construction Project Coordinator",
        "Job Description":"Construction Project Coordinators assist in managing construction projects, handling documentation, budget tracking, and coordinating subcontractors.",
        "skills":"Construction project management Building codes and regulations knowledge Budgeting and cost control Construction scheduling Contractor and subcontractor coordination",
        "Responsibilities":"Coordinate construction projects, including permits, subcontractors, and materials. Monitor project progress and timelines. Assist in budgeting and cost control.",
        "Summary":"\n  Job Tile: Project Coordinator\n  Job Description: Construction Project Coordinators assist in managing construction projects, handling documentation, budget tracking, and coordinating subcontractors.\n  Qualification: B.Tech\n  Experience: 0 to 11 Years\n  Skills: Construction project management Building codes and regulations knowledge Budgeting and cost control Construction scheduling Contractor and subcontractor coordination\n  Responsibilities: Coordinate construction projects, including permits, subcontractors, and materials. Monitor project progress and timelines. Assist in budgeting and cost control.\n  "
    },
    {
        "Experience":"0 to 14 Years",
        "Qualifications":"MCA",
        "Salary Range":"$64K-$81K",
        "Job Title":"Product Manager",
        "Role":"Agile Product Owner",
        "Job Description":"Agile Product Owners work closely with development teams in Agile environments. They define and prioritize product backlog items, communicate the product vision, and ensure that the product increments delivered align with customer needs and project objectives.",
        "skills":"Agile product development Scrum or Kanban frameworks Backlog management User story writing Prioritization techniques Collaboration with development teams Product vision and strategy",
        "Responsibilities":"Act as the product owner in agile development, making critical decisions and ensuring product goals are met. Maintain and prioritize the product backlog. Communicate with stakeholders and development teams.",
        "Summary":"\n  Job Tile: Product Manager\n  Job Description: Agile Product Owners work closely with development teams in Agile environments. They define and prioritize product backlog items, communicate the product vision, and ensure that the product increments delivered align with customer needs and project objectives.\n  Qualification: MCA\n  Experience: 0 to 14 Years\n  Skills: Agile product development Scrum or Kanban frameworks Backlog management User story writing Prioritization techniques Collaboration with development teams Product vision and strategy\n  Responsibilities: Act as the product owner in agile development, making critical decisions and ensuring product goals are met. Maintain and prioritize the product backlog. Communicate with stakeholders and development teams.\n  "
    },
    {
        "Experience":"5 to 8 Years",
        "Qualifications":"BA",
        "Salary Range":"$56K-$107K",
        "Job Title":"IT Administrator",
        "Role":"System Administrator",
        "Job Description":"System Administrators manage and maintain computer systems and networks. They handle software installations, security measures, and troubleshooting to ensure system reliability.",
        "skills":"System administration Network administration Troubleshooting Security management Server maintenance Backup and recovery",
        "Responsibilities":"Manage and maintain computer systems and servers. Install and configure software and hardware. Monitor system performance and security.",
        "Summary":"\n  Job Tile: IT Administrator\n  Job Description: System Administrators manage and maintain computer systems and networks. They handle software installations, security measures, and troubleshooting to ensure system reliability.\n  Qualification: BA\n  Experience: 5 to 8 Years\n  Skills: System administration Network administration Troubleshooting Security management Server maintenance Backup and recovery\n  Responsibilities: Manage and maintain computer systems and servers. Install and configure software and hardware. Monitor system performance and security.\n  "
    },
    {
        "Experience":"1 to 13 Years",
        "Qualifications":"B.Tech",
        "Salary Range":"$60K-$93K",
        "Job Title":"Sales Associate",
        "Role":"Retail Sales Associate",
        "Job Description":"A Retail Sales Associate assists customers in retail environments, helping them find products, providing product information, and ensuring a positive shopping experience.",
        "skills":"Customer service Sales techniques Product knowledge Cash handling Communication skills",
        "Responsibilities":"Assist customers in retail stores, answer questions, and provide product information. Process sales transactions and handle customer inquiries and returns. Maintain store displays and merchandising.",
        "Summary":"\n  Job Tile: Sales Associate\n  Job Description: A Retail Sales Associate assists customers in retail environments, helping them find products, providing product information, and ensuring a positive shopping experience.\n  Qualification: B.Tech\n  Experience: 1 to 13 Years\n  Skills: Customer service Sales techniques Product knowledge Cash handling Communication skills\n  Responsibilities: Assist customers in retail stores, answer questions, and provide product information. Process sales transactions and handle customer inquiries and returns. Maintain store displays and merchandising.\n  "
    },
    {
        "Experience":"2 to 14 Years",
        "Qualifications":"MCA",
        "Salary Range":"$57K-$102K",
        "Job Title":"Chemical Engineer",
        "Role":"Quality Control Engineer",
        "Job Description":"Monitor and maintain product quality standards, perform inspections, and implement quality control procedures.",
        "skills":"Quality control processes Quality assurance standards (e.g., ISO) Statistical analysis Inspection techniques Documenting quality issues Root cause analysis Communication with production teams Problem-solving Attention to detail Technical knowledge",
        "Responsibilities":"Focus on product quality assurance and testing. Develop quality control procedures and standards. Investigate and resolve quality issues.",
        "Summary":"\n  Job Tile: Chemical Engineer\n  Job Description: Monitor and maintain product quality standards, perform inspections, and implement quality control procedures.\n  Qualification: MCA\n  Experience: 2 to 14 Years\n  Skills: Quality control processes Quality assurance standards (e.g., ISO) Statistical analysis Inspection techniques Documenting quality issues Root cause analysis Communication with production teams Problem-solving Attention to detail Technical knowledge\n  Responsibilities: Focus on product quality assurance and testing. Develop quality control procedures and standards. Investigate and resolve quality issues.\n  "
    },
    {
        "Experience":"1 to 8 Years",
        "Qualifications":"BBA",
        "Salary Range":"$63K-$95K",
        "Job Title":"Legal Secretary",
        "Role":"Legal Assistant",
        "Job Description":"A Legal Assistant supports legal professionals by performing administrative and research tasks, organizing legal documents, and assisting with legal proceedings and documentation.",
        "skills":"Legal research Document drafting Communication skills Legal software proficiency Attention to detail",
        "Responsibilities":"Provide administrative support to legal professionals, including document preparation and filing. Maintain legal files and records. Schedule appointments and manage calendars.",
        "Summary":"\n  Job Tile: Legal Secretary\n  Job Description: A Legal Assistant supports legal professionals by performing administrative and research tasks, organizing legal documents, and assisting with legal proceedings and documentation.\n  Qualification: BBA\n  Experience: 1 to 8 Years\n  Skills: Legal research Document drafting Communication skills Legal software proficiency Attention to detail\n  Responsibilities: Provide administrative support to legal professionals, including document preparation and filing. Maintain legal files and records. Schedule appointments and manage calendars.\n  "
    },
    {
        "Experience":"0 to 15 Years",
        "Qualifications":"B.Com",
        "Salary Range":"$62K-$113K",
        "Job Title":"Market Analyst",
        "Role":"Competitive Intelligence Analyst",
        "Job Description":"Competitive Intelligence Analysts gather data on competitors and industry trends. They analyze information to help businesses make informed decisions and gain a competitive edge.",
        "skills":"Competitive analysis Market research Data analysis Business strategy Industry knowledge",
        "Responsibilities":"Research competitors and industry trends to assess market positioning. Analyze competitors strategies and product offerings. Provide recommendations for competitive advantage.",
        "Summary":"\n  Job Tile: Market Analyst\n  Job Description: Competitive Intelligence Analysts gather data on competitors and industry trends. They analyze information to help businesses make informed decisions and gain a competitive edge.\n  Qualification: B.Com\n  Experience: 0 to 15 Years\n  Skills: Competitive analysis Market research Data analysis Business strategy Industry knowledge\n  Responsibilities: Research competitors and industry trends to assess market positioning. Analyze competitors strategies and product offerings. Provide recommendations for competitive advantage.\n  "
    }
]